?;?;WWE 2K15 The Soundtrack;Soundtrack Music;?;2014 Atlantic Recording Corporation for the United States and WEA International for the world outside the United States A Warner Music Group Company;?;?
Marry the Night Danny Verde Remix;Lady Gaga;Marry the Night The Remixes;Pop Music Electronic Dance RandB / Soul Rock;1.29;2011 Interscope Records;?;20/12/11
Some Day;?;Us and Them;Rock Music Metal Alternative Hard Rock;1.29;2005 Atlantic Recording Corp For the United States and WEA International Inc for the world outside of the United States;194.0;04/10/05
?;Lady Gaga;Cheek to Cheek Deluxe Version;Jazz Music Pop Crossover Jazz Vocal Jazz;1.29;?;?;?
?;PNK;?;?;1.29;2009 RCA/JIVE Label Group a unit of Sony Music Entertainment;242.0;26/10/09
Ave MaryA Live;?;Funhouse Tour Live In Australia;Pop Music Dance RandB / Soul Pop/Rock;?;?;204.0;26/10/09
?;?;Nick Jonas Deluxe;Pop Music Rock Pop/Rock;?;2014 Island Records a division of UMG Recordings Inc / Safehouse Records LLC;228.0;10/11/14
Starry Eyed Live;Ellie Goulding;iTunes Festival London 2013  EP;Pop Music;1.29;2013 Polydor Ltd UK;223.0;22/10/13
?;?;Hotline Bling Single;?;?;?;267.0;31/07/15
Avalanche;WALK THE MOON;?;Alternative Music Indie Rock Rock;?;2014 RCA Records a division of Sony Music Entertainment;220.0;?
?;PNK;Funhouse Deluxe Version;Pop Music Pop/Rock Dance RandB / Soul;1.29;2008 LaFace Records LLC;232.0;28/10/08
I Have Seen the Rain feat James T Moore;PNK;I m Not Dead;Pop Music Electronic RandB / Soul Dance Pop/Rock;?;2006 LaFace Records LLC;210.0;03/04/06
Cinema feat Gary Go Skrillex Remix;Benny Benassi;Ultra / Wynn Presents Encore Beach Club Las Vegas Sessions Vol 1 Mixed By Sidney Samson;Dance Music Electronic;1.29;2012 Ultra Records Inc;307.0;28/08/12
?;?;?;Soundtrack Music;1.29;2012 Universal Republic Records a division of UMG Recordings Inc;244.0;20/03/12
?;?;The Taylor Swift Holiday Collection EP;Holiday Music Country Honky Tonk Christmas;?;?;154.0;14/10/07
Summer Love;One Direction;?;Pop Music Pop/Rock Teen Pop Rock Dance World;1.29;2012 Simco Limited under exclusive licence to Sony Music Entertainment UK Limited;208.0;09/11/12
Fly from the Inside Live Acoustic from WXDX Pittsburgh;Shinedown;Leave a Whisper Deluxe Version;Rock Music Hard Rock Alternative;1.29;2009 Atlantic Recording Corporation for the United States and WEA International for the world outside of the United States;239.0;27/05/03
Jack Daniels and Jesus;Chase Rice;Ignite the Night;Country Music Urban Cowboy Contemporary Country;1.29;2014 Dack Janiels Records;235.0;?
Blue Jeans Penguin Prison Remix;Lana Del Rey;?;?;1.29;?;336.0;01/05/12
?;Ed Sheeran;?;Singer/Songwriter Music Rock Adult Alternative Contemporary Singer/Songwriter;1.29;?;266.0;09/12/11
?;Jason Derulo;Summer Hits;Pop Music;?;?;207.0;?
I Know You Wo nt;Carrie Underwood;?;Country Music Rock Pop Contemporary Country;0.99;?;261.0;?
?;Luke Bryan;?;Country Music Contemporary Country;?;?;179.0;02/10/09
Be the One;NeYo;R E D Deluxe Edition;?;1.29;2012 Motown Records a Division of UMG Recordings Inc;?;06/11/12
?;Lana Del Rey;?;?;1.29;2012 Lana Del Rey under exclusive licence to Polydor Ltd UK Under exclusive licence to Interscope Records in the USA;?;13/11/12
ID Ultra Music Festival Anthem;?;ID Ultra Music Festival Anthem Single;?;?;?;289.0;30/07/15
Friday RT15 Edit feat Takura Prototypes Remix;Shadow Child;Running Trax 2015 Ministry of Sound;?;1.29;?;222.0;05/01/15
?;Calvin Harris;?;?;1.29;2012 Sony Music Entertainment UK under exclusive license to Ultra Music / Roc Nation / Columbia Records;?;30/10/12
Nothing Like Us Bonus Track;?;Believe Acoustic;Pop Music Rock Vocal Teen Pop;?;2013 The Island Def Jam Music Group;199.0;29/01/13
Workin Man Blues;Parmalee;?;?;?;2014 Broken Bow Records;162.0;01/04/14
Anything Could Happen Guy Scheiman TLV Club Remix;?;?;Pop Music Rock;1.29;?;465.0;15/01/13
Lucky Charm;Keith Urban;Fuse Deluxe Version;Country Music;?;2013 Hit Red Records under exclusive license to Capitol Records Nashville;186.0;10/09/13
Upside Down;Tori Kelly;Handmade Songs By Tori Kelly EP;Pop Music Rock;0.99;?;199.0;01/05/12
?;Justin Bieber;Believe Acoustic;Pop Music Rock Vocal Teen Pop;?;2013 The Island Def Jam Music Group;199.0;29/01/13
Weekends Zedd Remix;Skrillex;Weekends feat Sirah Single;Dance Music Electronic;1.29;2010 Big Beat Records Inc A Warner Music Group Company;?;25/10/10
?;Taylor Swift;?;Holiday Music Country Honky Tonk Christmas;?;2008 Big Machine Records LLC;154.0;?
?;Chris Young;The Man I Want to Be;?;0.99;2009 Sony Music Entertainment;?;27/08/09
Right Above It feat Drake;Lil Wayne and Drake;?;?;1.29;2010 Cash Money Records Inc;280.0;?
?;David Guetta;Hey Mama feat Nicki Minaj Bebe Rexha and Afrojack Remixes EP;Dance Music;?;?;282.0;12/05/15
A Rose and a Kiss;Aaron Zigman;?;Soundtrack Music;1.29;?;288.0;07/10/14
Tell Me When You Ready feat Future;Flo Rida;?;HipHop/Rap Music Rap;1.29;?;?;?
Pretty When You Cry;Lana Del Rey;?;?;1.29;2014 Lana Del Rey under exclusive licence to Polydor Ltd UK Under exclusive licence to Interscope Records in the USA;234.0;16/06/14
The Only Reason;5 Seconds of Summer;She Looks So Perfect Single;Pop Music Teen Pop Rock;?;2014 Capitol Records Ltd;?;17/11/14
?;?;Wildflower;?;1.29;2011 19 Recordings Inc;162.0;11/10/11
Na Na Na Live;?;?;Pop Music;?;2012 Simco Limited under exclusive license to Sony Music Entertainment UK Limited;219.0;20/09/12
Love Is the Drug;?;?;Soundtrack Music Classical Soundtrack;1.29;2013 Interscope Records;161.0;07/05/13
My Neck My Back Live;Elle King;The Elle King EP;?;1.29;2012 RCA Records a division of Sony Music Entertainment;160.0;11/06/12
Greenlight Bonus Track;?;5 Seconds of Summer Bonus Track Version;?;1.29;2014 Capitol Records Ltd;165.0;?
Halcyon;Ellie Goulding;Halcyon Days Deluxe Edition;Pop Music Dance Rock;?;?;204.0;?
?;Eric Church;Chief / Caught In the Act / Carolina / Sinners Like Me;?;1.29;2013 Capitol Nashville;269.0;17/12/13
?;PNK;Try This;Pop Music Dance RandB / Soul Pop/Rock Teen Pop Electronic;1.29;2003 Arista Records Inc;184.0;11/11/03
Welcome To New York;Taylor Swift;1989;?;1.29;2014 Big Machine Records LLC;212.0;27/10/14
Back to Me;Daya;?;Pop Music;1.29;2015 ARTBEATZ;?;04/09/15
?;Little Big Town;?;Contemporary Singer/Songwriter Music Singer/Songwriter Country Rock Southern Rock Urban Cowboy Contemporary CountryFolkRock;?;?;202.0;14/10/08
Fly;Maddie and Tae;?;?;1.29;?;218.0;28/08/15
?;Little Mix;?;Pop Music;1.29;2013 Simco Limited under exclusive licence to Sony Music Entertainment UK Limited;236.0;04/02/14
Remember You feat The Weeknd;Wiz Khalifa;O N I F C Deluxe Version;HipHop/Rap Music East Coast Rap Hardcore Rap Rap;1.99;?;320.0;?
Beyond the Forest;?;The Hobbit The Desolation of Smaug Original Motion Picture Soundtrack Special Edition;Soundtrack Music Soundtrack Classical Original Score;1.29;2013 WaterTower Music;325.0;10/12/13
?;?;Starry Eyed Remixes EP;Dance Music Pop Rock;1.29;2011 Polydor Ltd UK;494.0;15/02/11
Broken Strings feat James Morrison;Nelly Furtado and James Morrison;The Best of Nelly Furtado Deluxe Version;Pop Music Rock Vocal Adult Alternative Singer/Songwriter Contemporary Singer/Songwriter;0.99;?;250.0;?
Born This Way;Lady Gaga;Born This Way;Pop Music Rock Dance;1.29;2014 Interscope Records;260.0;05/08/14
Sweet Spot 2 0 feat Jennifer Lopez;Flo Rida;Wild Ones;?;?;2012 Atlantic Recording Corporation for the United States and WEA International Inc for the world outside of the United States;191.0;22/06/12
Bluegrass Saturday Night;Rhonda Vincent;Good Thing Going;Singer/Songwriter Music Country Contemporary Bluegrass Contemporary Country Bluegrass;1.29;?;?;21/07/08
You and Tequila feat Grace Potter;?;?;Country Music Honky Tonk Contemporary Country;?;?;?;?
The Alphabeat;David Guetta;Nothing But the Beat 2 0;?;?;2012 What A Music Ltd licence exclusive Parlophone Music France;269.0;?
Unapologize;Carrie Underwood;?;Country Music Pop Adult Contemporary Contemporary Country Rock;1.29;?;278.0;03/11/09
Raise Your Weapon;deadmau5;?;?;0.99;?;?;07/02/12
?;One Direction;?;Pop Music Rock Pop/Rock Teen Pop Dance;1.29;?;207.0;?
This Song Has No Title Live At Hammersmith Odeon London 1973;Elton John;?;Rock Music;1.29;2014 Mercury Records Limited;?;?
Cinema Laidback Luke Remix feat Gary Go;Benny Benassi;The Jersey Shore 3;?;0.99;2011 Ultra Records Inc;?;11/10/11
?;?;Us and Them;?;1.29;2005 Atlantic Recording Corp For the United States and WEA International Inc for the world outside of the United States;?;04/10/05
?;?;?;HipHop/Rap Music Rap Hardcore Rap Dirty South;?;2010 Cash Money Records Inc;?;?
Claire;Clarian and Guy Gerber;?;Dance Music;1.29;2013 Ministry of Sound Recordings Limited;?;?
Lifted feat Emeli Sand  and Professor Green;?;?;Pop Music Rock RandB / Soul Contemporary RandB DanceElectronicHipHop / Rap Pop/Rock;1.29;?;255.0;?
Beautiful Things Bonus Track;?;Unbreakable Smile Bonus Track Version;Pop Music RandB / Soul Vocal Rock Contemporary RandB Singer/Songwriter Contemporary Singer/Songwriter;?;2015 Capitol Records and Schoolboy Records;?;23/06/15
?;Ryan Adams;I Do Not Feel Like Being Good Single;?;1.29;?;158.0;28/04/15
So Happy I Could Die;Lady Gaga;The Fame Monster Deluxe Version;Pop Music;1.29;?;234.0;05/08/14
Dollar Signs feat Tinashe;?;Motion;Dance Music RandB / Soul Rock Electronic;?;?;?;04/11/14
?;Florida Georgia Line;Anything Goes;Country Music Honky Tonk Urban Cowboy Contemporary Country;1.29;?;186.0;14/10/14
?;deadmau5;Ultra Dubstep;Dance Music Electronic;1.29;?;?;09/10/12
Sunburn Bonus Track;Ed Sheeran;#NAME;?;1.29;2011 Warner Music UK Limited;275.0;?
Stronger Back On the Ground;Nick Jonas and The Administration;Who I Am;Rock Music Pop Teen Pop Pop/Rock;0.99;2010 Jonas Enterprises;294.0;02/02/10
Take My Drunk Ass Home Demo;?;Spring Break Here to Party;Country Music Contemporary Country;1.29;2013 Capitol Records Nashville All rights reserved Unauthorized reproduction is a violation of applicable laws Manufactured by Capitol Records Nashville 401 Commerce Street Suite 1100 Nashville TN 37219;?;?
?;Ryan Adams;Ashes and Fire;?;?;?;259.0;30/09/14
?;?;Autonomy EP;?;0.99;?;299.0;28/03/11
The Patron Saint of Liars and Fakes Album Version;?;Take This to Your Grave;Alternative Music Punk Rock;0.99;2003 Fueled By Ramen LLC;199.0;?
?;Kenny Chesney;The Road and the Radio;Country Music Honky Tonk Urban Cowboy Contemporary Country;0.99;2005 BMG Music;311.0;06/11/05
Greenlight Bonus Track;5 Seconds of Summer;5 Seconds of Summer Bonus Track Version;Pop Music Teen Pop Alternative Punk Rock;?;?;165.0;22/07/14
Crack In the Pearl Pt II feat Stevie Wonder and Jeff Bhasker;Mark Ronson;Uptown Special;Pop Music RandB / Soul Soul Funk Electronic;?;?;136.0;12/01/15
?;Lady Gaga;?;?;1.29;2011 Interscope Records;465.0;?
Four Leaf Clover;Little Big Town;A Place to Land;?;1.29;?;202.0;14/10/08
VHS Outro Interlude;X Ambassadors;VHS;?;1.29;2015 KIDinaKORNER/Interscope Records;85.0;30/06/15
Human;?;Spectrum EP;?;?;?;257.0;31/07/12
?;Wiz Khalifa;Deal Or No Deal;HipHop MusicHipHop / Rap Hardcore Rap;1.29;Rostrum Records 2009;203.0;?
Crack In the Pearl Pt II feat Stevie Wonder and Jeff Bhasker;Mark Ronson;Uptown Special;Pop Music RandB / Soul Funk Soul;1.29;?;?;13/01/15
?;?;Wildflower;?;1.29;2011 19 Recordings Inc;?;11/10/11
Epilogue feat George the Poet;Naughty Boy;Hotel Cabana;?;1.29;2014 Naughty Boy Recordings Ltd under exclusive licence to Virgin Records Ltd;?;06/05/14
If This Was a Movie;?;?;?;?;?;234.0;08/11/11
Electro Man;Calvin Harris;I Created Disco;?;?;2007 SONY BMG MUSIC ENTERTAINMENT UK Limited;?;11/06/07
All My Love feat Ariana Grande and Machel Montano Remix;Major Lazer;Peace Is the Mission;Electronic Music Reggae Modern Dancehall Dance;1.29;2015 Mad Decent;229.0;01/06/15
Livin Part of Life;Eric Church;Chief / Caught In the Act / Carolina / Sinners Like Me;Country Music Rock Southern Rock Contemporary Country;1.29;2013 Capitol Nashville;269.0;?
?;?;VHS;Alternative Music Rock Adult Alternative;?;?;?;30/06/15
My Favorite Memory;Joe Nichols;Working Man s Poet A Tribute To Merle Haggard;Country Music;1.29;?;193.0;01/04/14
Dream;?;Hannah Montana The Movie Original Motion Picture Soundtrack;Soundtrack Music Country Contemporary Country Pop Teen Pop Honky Tonk Rock;1.29;2009 Walt Disney Records;201.0;24/03/09
Who s That Chick feat Rihanna Single Version;David Guetta and Rihanna;?;?;0.99;2010 Gum Prod licence exclusive Parlophone Music France;?;?
?;Phil Jupitus Boz Boorer and Phil Rambow;A Concert for Kirsty MacColl Live;?;1.29;2013 Union Square Music Ltd;236.0;?
Twin Skeleton s Hotel In NYC;Fall Out Boy;American Beauty / American Psycho;Alternative Music;?;2015 Island Records a division of UMG Recordings Inc;220.0;20/01/15
?;Jason Derulo;?;Pop Music Rock Dance RandB / Soul Contemporary RandB;?;?;?;?
Titanium Spanish Version;David Guetta;?;Dance Music Electronic;1.29;?;238.0;20/08/12
The Climb;?;?;Soundtrack Music Country Contemporary Country Pop Teen Pop Honky Tonk Rock;1.29;?;236.0;?
Second Chance Live Acoustic from Kansas City;Shinedown;?;Rock Music Metal Alternative Hard Rock;?;?;306.0;18/04/11
I Thought You Knew;?;Keith Urban;Country Music Honky Tonk Contemporary Country;1.29;1999 Capitol Records Nashville;231.0;19/10/99
We Know;Fifth Harmony;Reflection;?;1.29;?;177.0;30/01/15
Boyfriend Joe Gauthreaux Dark Dub;Justin Bieber;Boyfriend Remixes;Dance Music Rock;1.29;?;466.0;12/06/12
Remember You feat The Weeknd;Wiz Khalifa;O N I F C Deluxe Version;?;1.99;?;320.0;?
Marry Me;?;?;?;1.29;2013 2014 Warner Bros Records Inc;225.0;?
The Way I Loved You;Taylor Swift;Fearless;Country Music Rock Honky Tonk Pop Adult Contemporary Contemporary Country;1.29;?;244.0;11/11/08
Second Chance Live Acoustic from Kansas City;?;Somewhere In the Stratosphere Live;Rock Music Metal Alternative Hard Rock;?;2011 Atlantic Recording Corporation for the United States and WEA International Inc for the world outside of the United States;?;?
Give Me Back My Hometown;Eric Church;?;Country Music Contemporary Country Urban Cowboy;1.29;2013 EMI Records Nashville;?;?
?;?;Somewhere In the Stratosphere Live;Rock Music Metal Alternative Hard Rock;1.29;?;306.0;18/04/11
Philadelphia Freedom;?;Goodbye Yellow Brick Road 40th Anniversary Celebration Super Deluxe Edition;Rock Music;1.29;?;?;24/03/14
Love Song;PNK;Try This;?;?;?;148.0;10/11/03
?;Nelly Furtado;?;Pop Music Rock Vocal Adult Alternative Singer/Songwriter Contemporary Singer/Songwriter;1.29;2010 Geffen Records;258.0;?
Tackle Box;?;I ll Stay Me;Country Music Contemporary Country Pop;1.29;2006 2007 Capitol Records Nashville All rights reserved Unauthorized reproduction is a violation of applicable laws Manufactured by Capitol Records Nashville 3322 West End Avenue 11th Floor Nashville TN 37203;242.0;14/08/07
?;twenty one pilots;Vessel;Alternative Music Rock Indie RockHipHop / Rap Rap Underground Rap;1.29;2012 Fueled By Ramen LLC for the United States and WEA International Inc for the world outside of the United States;142.0;04/01/13
Na Na Na Live;One Direction;iTunes Festival London 2012 EP;?;1.29;2012 Simco Limited under exclusive license to Sony Music Entertainment UK Limited;219.0;20/09/12
Anna Sun Live;WALK THE MOON;iTunes Festival London 2012 EP;?;1.29;2012 RCA Records a division of Sony Music Entertainment;?;10/09/12
Lips Are Movin;Meghan Trainor;Title;Pop Music Pop/Rock Dance Rock Teen Pop;1.29;2014 2015 Epic Records a division of Sony Music Entertainment;181.0;09/01/15
Dance Dance;?;From Under the Cork Tree Limited Black Clouds and Underdogs Edition EP;Alternative Music;1.99;2006 The Island Def Jam Music Group;?;14/03/06
Truce;twenty one pilots;?;Alternative Music Rock Indie RockHipHop / Rap Rap Underground Rap;1.29;2012 Fueled By Ramen LLC for the United States and WEA International Inc for the world outside of the United States;?;?
?;Eminem;Recovery Deluxe Edition;HipHop/Rap Music Rock Hardcore Rap Rap;1.29;2010 Aftermath Records;275.0;?
Jaded The Sound of Deep House Edit;Toyboy and Robin;The Sound of Deep House Ministry of Sound;Dance Music;1.29;2013 Ministry of Sound Recordings Limited;?;?
Love Story;Taylor Swift;Fearless;?;1.29;2008 Big Machine Records LLC;?;11/11/08
Look In the Mirror;Ryan Adams;Burn In the Night Single;Rock Music;1.29;2015 PaxAmericana Recording Company;?;23/06/15
The Drugs Not Working;Ryan Adams;?;?;1.29;2014 UMG Recordings Inc;332.0;?
Cameras;Wiz Khalifa;Rolling Papers;HipHop/Rap Music Rap East Coast Rap Hardcore Rap;1.29;2011 Atlantic Recording Corporation for the United States and WEA International Inc for the world outside of the United States;269.0;?
John Cougar John Deere John 316;?;?;Country Music;?;2015 Hit Red Records under exclusive license to Capitol Records Nashville;221.0;09/06/15
Elevator;Eminem;?;?;1.29;2009 Aftermath Records;292.0;?
Hooker;?;Try This;?;1.29;2003 Arista Records Inc;?;?
Hair;?;Born This Way;Pop Music Rock Dance;?;2014 Interscope Records;308.0;05/08/14
Amnesia;?;5 Seconds of Summer;?;?;2014 Capitol Records Ltd;237.0;22/07/14
Who s That Chick feat Rihanna Single Version;?;Who s That Chick feat Rihanna EP;House Music Dance Rock Electronic;0.99;2010 Gum Prod licence exclusive Parlophone Music France;165.0;03/12/10
?;Justin Bieber;As Long As You Love Me Remixes feat Big Sean;?;1.29;?;280.0;11/09/12
Money Right feat Rick Ross and Brisco;Flo Rida;Mail On Sunday;HipHop/Rap Music Pop Dirty South;?;2008 Atlantic Recording Corporation for the United States and WEA International Inc for the world outside of the United States;?;?
?;Jason Derulo;?;Pop Music Rock Dance RandB / Soul Contemporary RandB;?;2015 Warner Bros Records Inc;313.0;29/05/15
Till Dawn Here Comes the Sun;The Weeknd;Echoes of Silence;?;1.29;?;319.0;?
Electro Man;Calvin Harris;?;Electronic Music Pop Dance Rock;?;2007 SONY BMG MUSIC ENTERTAINMENT UK Limited;298.0;?
?;?;Reflection Deluxe;Pop Music RandB / Soul Dance Teen Pop Rock;1.29;2014 2015 Simco Ltd under exclusive license to Epic Records a division of Sony Music Entertainment;?;30/01/15
Every Time I See You;?;Doin My Thing;Country Music Contemporary Country;1.29;2009 Capitol Records Nashville All rights reserved Unauthorized reproduction is a violation of applicable laws Manufactured by Capitol Records Nashville 3322 West End Avenue 11th Floor Nashville TN 37203;245.0;02/10/09
?;?;Andy Grammer;?;?;2011 SCurve Records;?;?
?;Carly Rae Jepsen and Owl City;Kiss;Pop Music Rock Vocal Dance Teen Pop World;1.29;2012 School Boy/Interscope Records;205.0;?
Angel;The Weeknd;Beauty Behind the Madness;RandB / Soul Music;?;2015 The Weeknd XO Inc Manufactured and Marketed by Republic Records a Division of UMG Recordings Inc;377.0;28/08/15
As Long As You Love Me feat Big Sean Audien Luvstep Mix;?;As Long As You Love Me Remixes feat Big Sean;Dance Music Rock;?;?;?;?
Thank Me Now;Drake;Thank Me Later;?;?;?;328.0;?
Dollar Signs feat Tinashe;?;Motion;Dance Music RandB / Soul Rock Electronic;?;2014 Sony Music Entertainment UK Limited;236.0;?
The Race;Wiz Khalifa;Rolling Papers Deluxe Version;HipHop/Rap Music Hardcore Rap East Coast Rap Rap;1.29;2011 Atlantic Recording Corporation for the United States and WEA International Inc for the world outside of the United States;335.0;28/03/11
Alone Together Jump Smokers Remix;Fall Out Boy;?;Dance Music;?;2014 The Island Def Jam Music Group;221.0;?
From This Dream;?;Little Big Town;Country Music Urban Cowboy Honky Tonk Contemporary Country;0.99;2002 SONY BMG MUSIC ENTERTAINMENT;267.0;07/05/02
These Are the Days;Keith Urban;Be Here;Country Music Honky Tonk Contemporary Country;1.29;?;169.0;21/09/04
?;Clarian and Guy Gerber;Chilled House Ibiza 2013 Ministry of Sound;?;?;2013 Ministry of Sound Recordings Limited;419.0;?
?;Luke Bryan;Crash My Party Deluxe;?;1.29;2014 Capitol Records Nashville;222.0;?
You re Not My God;Keith Urban;Golden Road;Country Music Honky Tonk Contemporary Country;1.29;?;511.0;04/10/02
?;David Guetta;Nothing But the Beat;?;1.29;?;214.0;26/08/11
Let s Get Crazy;Hannah Montana;Hannah Montana The Movie Original Motion Picture Soundtrack;Soundtrack Music Country Contemporary Country Pop Teen Pop Honky Tonk Rock;?;?;155.0;?
Wo nt Back Down feat Pink;Eminem Featuring Pnk;?;?;1.29;2010 Aftermath Records;265.0;?
?;?;I Am Not a Human Being;HipHop/Rap Music Rap Hardcore Rap Dirty South;?;2010 Cash Money Records Inc;262.0;15/11/10
Slow Down;Yellow Claw DJ Snake and Spanker;Amsterdam Twerk Music EP;Dance Music Electronic;1.29;2013 Mad Decent;249.0;15/10/13
The Sand I Brought To the Beach;Luke Bryan;Spring Break 6 Like We Ai nt Ever EP;Country Music;1.29;?;206.0;11/03/14
6PM In New York;Drake;If You re Reading This It s Too Late;HipHop/Rap Music Hardcore Rap Rap RandB / Soul;1.29;2015 Cash Money Records Inc;?;?
?;Lana Del Rey;Blue Jeans Omid 16B Remixes;Dance Music Rock Adult Alternative;1.29;2013 Alola Records;155.0;21/01/13
?;Rudderless;?;Soundtrack Music Soundtrack;1.29;2014 Lakeshore Records;100.0;30/09/14
Skrillex Orchestral Suite By Varien Bonus Track;Skrillex;Bangarang;Dance Music Electronic;?;2012 Big Beat Records Inc for the United States and WEA International for the world outside the United States;414.0;?
Teeth;Lady Gaga;?;Pop Music;1.29;2014 Interscope Records;220.0;05/08/14
?;Nelly Furtado and Juanes;The Best of Nelly Furtado Deluxe Version;Pop Music Rock Vocal Adult Alternative Singer/Songwriter Contemporary Singer/Songwriter;1.29;2010 Geffen Records;?;16/11/10
?;?;Talk Dirty;?;1.29;2013 2014 Warner Bros Records Inc;225.0;?
?;?;?;HipHop/Rap Music Rock Hardcore Rap Rap;1.29;?;300.0;?
Who Dat Girl feat Akon 8 Barz Club Mix;Flo Rida;?;?;?;?;?;?
Act My Age;?;FOUR Ultimate Edition;Pop Music;1.29;2014 Simco Limited under exclusive license to Sony Music Entertainment UK Limited;198.0;17/11/14
?;Wiz Khalifa;Deal Or No Deal;HipHop MusicHipHop / Rap Hardcore Rap;?;Rostrum Records 2009;203.0;24/11/09
?;?;?;Country Music Contemporary Country;?;2013 Capitol Records Nashville All rights reserved Unauthorized reproduction is a violation of applicable laws Manufactured by Capitol Records Nashville 401 Commerce Street Suite 1100 Nashville TN 37219;202.0;?
?;Calvin Harris;18 Months;Dance Music House Rock Electronic;1.29;2012 Sony Music Entertainment UK under exclusive license to Ultra Music / Roc Nation / Columbia Records;247.0;30/10/12
Mellow Out;Nathaniel Rateliff and The Night Sweats;Nathaniel Rateliff and The Night Sweats;Rock Music RandB / Soul Roots Rock;1.29;2015 Bottleneck Music Limited under exclusive license to Concord Music Group Inc;212.0;?
?;Olivia NewtonJohn Amy Sky and RyanDan;A Celebration In Song;?;1.29;2011 ONJ Productions Inc All rights reserved Unauthorized reproduction is a violation of applicable laws Manufactured by EMI CMG;?;25/01/11
Little White Lies;?;Midnight Memories Deluxe Edition;?;?;2013 Simco Limited under exclusive license to Sony Music Entertainment UK Limited;197.0;25/11/13
Ca nt Believe It feat Pitbull;Flo Rida;?;HipHop/Rap Music Rap;?;2013 Atlantic Recording Corporation for the United States and WEA International Inc for the world outside of the United States;223.0;28/07/13
Dangerous feat Sam Martin Kevin Saunderson Inner City Remix;David Guetta;Dangerous feat Sam Martin Remixes EP;Dance Music;?;2014 What A Music Ltd under exclusive license to Parlophone/Warner Music France under exclusive license to Atlantic Recording Corporation for the United States All rights reserved;?;?
VHS Outro Interlude;?;VHS;Alternative Music Rock Adult Alternative;1.29;2015 KIDinaKORNER/Interscope Records;85.0;30/06/15
Split Only U;Ti sto and The Chainsmokers;Split Only U Single;?;0.99;?;306.0;14/09/15
?;Calvin Harris;?;?;?;2007 SONY BMG MUSIC ENTERTAINMENT UK Limited;298.0;11/06/07
?;?;Speak Now;Country Music Rock Contemporary Country Honky Tonk;?;2010 Big Machine Records LLC;302.0;25/10/10
Ai nt Back Yet;Kenny Chesney;Greatest Hits II;Country Music Urban Cowboy Contemporary Country;1.29;2010 Sony Music Entertainment;239.0;01/03/10
?;Selena;Enamorada de Ti;Regional Mexicano Music Latino Latin Pop;1.29;2012 Capitol Latin All rights reserved Unauthorized reproduction is a violation of applicable laws Manufactured by Capitol Latin 404 Washington Ave Suite 700 Miami Beach FL 33139;190.0;30/03/12
?;?;Greatest Hits Deluxe Edition;Country Music Honky Tonk Contemporary Country;1.29;?;?;?
?;Fall Out Boy;Infinity On High Deluxe Edition;Alternative Music Rock Adult Alternative Punk;0.99;2007 The Island Def Jam Music Group;212.0;20/11/07
Let Go;Ryan Adams;Ryan Adams;?;?;?;223.0;09/09/14
I m a Machine feat Crystal Nicole and Tyrese Gibson;?;Nothing But the Beat;Dance Music Rock House Electronic;1.29;2011 What A Music Ltd Licence exclusive Parlophone Music France;214.0;26/08/11
Fire Away;?;Recess;Dance Music Electronic Rock;1.29;?;342.0;14/03/14
?;Carrie Underwood;Play On;Country Music Pop Adult Contemporary Contemporary Country Rock;1.29;?;?;03/11/09
Let s Chase Each Other Around the Room;Thompson Square;Working Man s Poet A Tribute To Merle Haggard;Country Music;1.29;2014 Broken Bow Records;190.0;?
Jack Daniels and Jesus;?;Ignite the Night;Country Music Urban Cowboy Contemporary Country;1.29;2014 Dack Janiels Records;235.0;19/08/14
Livin Part of Life;Eric Church;Chief / Caught In the Act / Carolina / Sinners Like Me;?;1.29;?;269.0;17/12/13
You Need Me I Do nt Need You Live At the Bedford;Ed Sheeran;Live At the Bedford;?;1.29;?;590.0;?
Sunburn Bonus Track;Ed Sheeran;#NAME;?;1.29;?;275.0;09/09/11
Capture Me;Rollz;UKF Bass Culture 2;Dance Music Electronic;0.99;2012 UKF Music;308.0;02/09/12
Back To Back;Drake;?;HipHop/Rap Music;?;2015 Cash Money Records Inc;?;31/07/15
My Winding Wheel iTunes Session;?;?;Rock Music;?;2012 PaxAmericana Recording Company Under Exclusive License to Capitol Records All rights reserved Unauthorized reproduction is a violation of applicable laws Manufactured by Capitol Records LLC 1750 North Vine Street Hollywood CA 90028;214.0;?
I m a Machine feat Crystal Nicole and Tyrese Gibson;David Guetta;Nothing But the Beat;?;1.29;?;214.0;26/08/11
Teardrops On My Guitar Instrumental With Background Vocals;?;Taylor Swift Karaoke Instrumentals With Background Vocals;Country Music Contemporary Country Honky Tonk;0.99;?;?;?
