Little Me Unplugged;Little Mix;?;Pop Music;1.29;2013 Simco Limited under exclusive licence to Sony Music Entertainment UK Limited;236.0;?
Isle of Flightless Birds;?;?;Rock Music Pop;0.99;?;?;29/12/09
Shocker;Tisto and Dj Punish;Club Life Vol 3 Stockholm;?;?;2013 Musical Freedom;?;18/06/13
Headphones;?;?;Country Music Urban Cowboy Honky Tonk Contemporary Country;?;2013 Big Machine Label Group LLC;224.0;?
Little Me Unplugged;Little Mix;Salute Deluxe Edition;Pop Music;1.29;?;236.0;04/02/14
This Is What It Takes;Shawn Mendes;Handwritten;?;?;2015 Island Records a division of UMG Recordings Inc;230.0;?
Through the Ghost;Shinedown;The Studio Album Collection;?;1.29;2013 Atlantic Recording Corporation for the United States and WEA International Inc for the world outside of the United States A Warner Music Group Company;241.0;?
Because of Your Love;Kenny Chesney;Greatest Hits;Country Music Contemporary Country Urban Cowboy;0.99;?;256.0;26/09/00
I Wo nt Give Up;?;Jana Kramer;?;?;2012 Warner Music Nashville LLC and WEA International Inc for the world outside the U S;?;01/06/12
Dirt Road Diary;?;Crash My Party;Country Music Contemporary Country;1.29;2013 Capitol Records Nashville;?;13/08/13
?;One Direction;?;?;1.29;2013 Simco Limited under exclusive license to Sony Music Entertainment UK Limited;200.0;?
?;?;?;Pop Music Dance Rock;?;2013 Polydor Ltd UK;?;27/08/13
?;The Weeknd;Thursday;RandB / Soul Music Contemporary RandB Rock;1.29;?;?;17/02/15
Stars Come Out Tim Mason Remix;?;Stars Come Out Remixes EP;?;1.29;2012 Dim Mak Inc;349.0;20/05/14
Afire Love;?;x;Singer/Songwriter Music Pop Rock Contemporary Singer/Songwriter Adult Alternative;?;2014 Asylum Records UK a Warner Music UK Company;314.0;?
?;Lana Del Rey;Honeymoon;?;1.29;2015 Polydor Ltd UK;295.0;18/09/15
The Back Roads and the Back Row;Cole Swindell;Cole Swindell;Country Music Contemporary Country;?;?;?;18/02/14
?;?;VHS;?;?;?;?;30/06/15
?;Drake;?;HipHop/Rap Music;?;?;?;?
Uptown Funk feat Bruno Mars Will Sparks Remix;?;Uptown Funk Remixes EP;Pop Music Rock;?;?;?;?
The Sky s the Limit Wideboys Club Mix;Jason Derulo;Jason Derulo Special Edition EP;Pop Music RandB / SoulHipHop / Rap Rap Rock Contemporary RandB;?;2010 Warner Bros Records Inc;421.0;01/07/11
?;?;FOUR Ultimate Edition;Pop Music;1.29;?;198.0;17/11/14
Livin Part of Life;?;Chief / Caught In the Act / Carolina / Sinners Like Me;Country Music Rock Southern Rock Contemporary Country;1.29;2013 Capitol Nashville;?;17/12/13
All Good Things Come to an End;Nelly Furtado;The Best of Nelly Furtado Deluxe Version;Pop Music Rock Vocal Adult Alternative Singer/Songwriter Contemporary Singer/Songwriter;?;2010 Geffen Records;309.0;?
Beautiful Now feat Jon Bellion Charlie Darker Remix;Zedd;Beautiful Now feat Jon Bellion Remixes EP;?;1.29;2015 Interscope Records;255.0;10/07/15
?;Wiz Khalifa;?;HipHop/Rap Music Hardcore Rap East Coast Rap Rap;1.29;?;?;28/03/11
Somos Under;Cabalucci MC Ceja and Mexicano 777;?;Latin Urban Music Latino;0.99;?;310.0;?
Suburbia;Ryan Adams;Vampires Paxam Singles Series Volume 3 EP;?;?;?;?;?
?;Major Lazer;Free the Universe Extended Version;?;?;2013 Secretly Canadian / Mad Decent;?;?
?;?;Shake It Up I < 3 Dance Music from the TV Series;?;?;2013 Walt Disney Records;201.0;05/03/13
You  re Never Over;Eminem;Recovery;?;?;?;?;21/06/10
I Told You So;?;Carnival Ride;?;?;?;259.0;?
?;The Mavericks;Nashville Outlaws A Tribute to M  tley Cre;Country Music;1.29;2014 Big Machine Records LLC;?;19/08/14
?;Florida Georgia Line;?;?;1.29;2013 Big Machine Label Group LLC;?;25/11/13
Old Blue Chair Acoustic Version;Kenny Chesney;?;Country Music Contemporary Country Urban Cowboy;1.29;2004 BMG Music;211.0;?
Jump Disco Fries Extended Mix;?;Jump Remixes feat Nelly Furtado;?;1.29;2009 Atlantic Recording Corporation for the United States and WEA International Inc for the world outside of the United States;274.0;?
?;Flo Rida;?;HipHop/Rap Music;?;?;?;21/01/15
Picture to Burn Live;?;iTunes Live from SoHo;?;1.29;?;213.0;15/01/08
Bang Bang My Baby Shot Me Down Live from Jazz At Lincoln Center Bonus Track;?;?;?;1.29;2014 Columbia Records a division of Sony Music Entertainment / Interscope Records a division of UMG Recordings Inc;223.0;?
Is It Love;?;Ca nt Take Me Home;Pop Music Dance RandB / Soul Pop/Rock Teen Pop Contemporary RandB;0.99;1999 2000 LaFace Records LLC;218.0;?
Marry Me;Jason Derulo;Talk Dirty;?;1.29;2013 2014 Warner Bros Records Inc;225.0;?
Somebody to Love Remix feat Usher;?;Never Say Never The Remixes;Pop Music Teen Pop Dance Rock Vocal;1.29;?;220.0;?
?;Dillon Francis;?;Dance Music Electronic;?;2015 Columbia Records a Division of Sony Music Entertainment;241.0;14/08/15
Find You feat Matthew Koma and Miriam Bryant Mike Hawkins Remix;?;?;?;1.29;2014 Interscope Records;266.0;08/04/14
Closer feat Mike Posner;Nick Jonas;?;Pop Music Teen Pop Pop/Rock Rock;?;2014 Island Records a division of UMG Recordings Inc / Safehouse Records LLC;228.0;10/11/14
The Mathlete Rap;?;Mean Girls Original Motion Picture Soundtrack;?;0.99;?;?;01/01/04
Birthday;Flo Rida;Birthday Single;HipHop/Rap Music;0.99;?;?;04/12/07
Stuck In the Moment Acoustic Version;Justin Bieber;My Worlds Acoustic;Pop Music Vocal RandB / Soul Contemporary RandB Rock Teen Pop;1.29;2011 The Island Def Jam Music Group;198.0;08/02/11
?;?;?;?;?;?;190.0;?
?;?;Crash My Party Deluxe;?;1.29;2014 Capitol Records Nashville;222.0;12/08/14
?;?;?;Dance Music RandB / Soul Disco Electronic Rock;0.99;2007 SONY BMG MUSIC ENTERTAINMENT UK Limited;236.0;?
Isle of Flightless Birds;?;twenty one pilots;?;?;2009 Twenty One Pilots;345.0;?
?;?;?;?;0.99;?;?;18/06/07
It s All Your Fault Live;PNK;Funhouse Tour Live In Australia;?;?;2009 RCA/JIVE Label Group a unit of Sony Music Entertainment;?;26/10/09
Fire Away;Skrillex;Recess;Dance Music Electronic Rock;1.29;2014 OWSLA/Big Beat Records Inc for the United States and WEA International Inc for the world outside of the United States;342.0;?
Paparazzi;?;?;Pop Music;1.29;?;208.0;05/08/14
?;Calvin Harris;?;?;0.99;?;298.0;11/06/07
Candle In the Wind Acoustic Mix;?;?;Rock Music;?;2014 Mercury Records Limited;233.0;?
Scarecrows;Luke Bryan;?;Country Music Rock Contemporary Country;1.29;?;?;?
It s d Only Thang;Snoop Dogg;Doggumentary;HipHop/Rap Music Rock Gangsta Rap West Coast Rap;1.29;2011 Capitol Records LLC All rights reserved Unauthorized reproduction is a violation of applicable laws Manufactured by Capitol Records LLC 1750 North Vine Street Hollywood CA 90028;?;29/03/11
?;Shinedown;The Studio Album Collection;?;?;?;241.0;08/11/13
Kanye feat sirenXX Chardy Remix;The Chainsmokers;Kanye Remixes Pt 1 feat sirenXX Single;Electronic Music;?;?;242.0;?
?;The Weeknd;Thursday;RandB / Soul Music Contemporary RandB Rock;1.29;2015 The Weeknd XO Inc;286.0;17/02/15
Whatcha Got In That Cup;Thomas Rhett;It Goes Like This;Country Music Contemporary Country Honky Tonk;?;?;?;29/10/13
?;Jana Kramer;?;Country Music Honky Tonk Contemporary Country;1.29;2012 Warner Music Nashville LLC and WEA International Inc for the world outside the U S;?;?
Extra Extra Credit;?;?;?;?;2009 Rostrum Records;?;17/04/09
?;?;TALKING IS HARD;?;1.29;2014 RCA Records a division of Sony Music Entertainment;?;?
Silver and Gold;?;Pain Killer;?;1.29;2014 Little Big Town LLC Under exclusive license to Capitol Records Nashville;213.0;?
Jack Daniels and Jesus;Chase Rice;Ignite the Night;?;?;2014 Dack Janiels Records;?;19/08/14
The Sound of Music;Carrie Underwood;?;Soundtrack Music;1.29;?;186.0;?
?;The Weeknd;?;RandB / Soul Music Rock Contemporary RandB;?;?;?;?
?;Elle King;Love Stuff;Alternative Music Rock;?;?;206.0;13/02/15
Isle of Flightless Birds;?;?;?;0.99;2009 Twenty One Pilots;345.0;?
There s an Angel Floating Round This House Live;Brian Kennedy;?;?;1.29;2013 Union Square Music Ltd;?;?
One Click Headshot;Feed Me;UKF Bass Culture 2;Dance Music Electronic;?;2012 UKF Music;287.0;02/09/12
?;Drake;So Far Gone;HipHop/Rap Music Pop RandB / Soul Contemporary RandB Hardcore Rap Dirty South;1.29;?;?;?
Bad Influence Live;PNK;Funhouse Tour Live In Australia;?;0.99;2009 RCA/JIVE Label Group a unit of Sony Music Entertainment;298.0;?
Word Up;Little Mix;Word Up Single;Pop Music;1.29;2014 Simco Limited under exclusive license to Sony Music Entertainment UK Limited;?;14/03/14
Hot Coals;Cold War Kids;Hold My Home Deluxe Edition;Alternative Music Indie Rock Rock;1.29;?;208.0;11/09/15
The Sky s the Limit Wideboys Club Mix;?;Jason Derulo Special Edition EP;?;?;2010 Warner Bros Records Inc;421.0;01/07/11
?;Little Big Town;Pain Killer;?;?;2014 Little Big Town LLC Under exclusive license to Capitol Records Nashville;213.0;?
Cameras;Wiz Khalifa;Rolling Papers Deluxe Version;HipHop/Rap Music Hardcore Rap East Coast Rap Rap;?;2011 Atlantic Recording Corporation for the United States and WEA International Inc for the world outside of the United States;?;?
Please Come to Boston Live;Kenny Chesney;?;Country Music Contemporary Country Urban Cowboy;1.29;?;240.0;02/02/04
?;LMFAO;Sorry for Party Rocking Deluxe Version;?;1.29;2011 Foo and Blu LLC under exclusive License to Interscope Records;199.0;?
Tus Desprecios;?;?;Regional Mexicano Music Latino Latin Pop;1.29;?;?;30/03/12
Demons;Kenny Chesney;Just Who I Am Poets and Pirates;Country Music Contemporary Country;?;2007 Sony Music Entertainment;329.0;08/09/07
All This Could Be Yours Return to Tackyland;Cold War Kids;Hold My Home Deluxe Edition;Alternative Music Indie Rock Rock;?;?;199.0;11/09/15
?;Holly Williams;Here With Me;Country Music Rock Adult Alternative;0.99;2009 Mercury Records a Division of UMG Recordings Inc;?;?
?;Justin Bieber;Believe;?;1.29;?;230.0;19/06/12
?;?;+;Singer/Songwriter MusicFolkRock Rock Adult Alternative Singer/Songwriter Contemporary Singer/Songwriter;?;2011 Warner Music UK Limited;526.0;?
We Dem Boyz;?;Blacc Hollywood Deluxe Version;?;1.99;?;?;19/08/14
Save Me Pull Mix;Shinedown;Shinedown EP;?;?;2006 Atlanic Recording Corp for the United States and WEA International Inc for the world outside of the United States;259.0;20/06/06
?;PNK;Funhouse Tour Live In Australia;Pop Music Dance RandB / Soul Pop/Rock;?;2009 RCA/JIVE Label Group a unit of Sony Music Entertainment;?;26/10/09
?;Fall Out Boy;?;Alternative Music;1.99;2006 The Island Def Jam Music Group;277.0;?
Corn;Chris Janson;Chris Janson EP;?;?;?;234.0;03/09/13
Outversion;Mark Ronson;Version;?;?;?;?;10/07/07
?;?;Settle;?;1.29;2013 Universal Island Records a division of Universal Music Operations Limited;269.0;?
Low Live;Flo Rida;?;?;1.29;2009 Atlantic Recording Corporation for the United States and WEA International Inc for the world outside of the United States;237.0;30/03/09
?;Lana Del Rey;Big Eyes Music from the Original Motion Picture;?;?;?;348.0;?
Greenlight Bonus Track;5 Seconds of Summer;5 Seconds of Summer Bonus Track Version;Pop Music Teen Pop Alternative Punk Rock;?;2014 Capitol Records Ltd;165.0;22/07/14
Happy Hour Worktape;Chase Rice;Dirt Road Communion;?;?;?;?;20/03/12
You re Not Sorry Instrumental With Background Vocals;?;?;Country Music;0.99;2009 Big Machine Records LLC;264.0;07/04/09
?;?;?;Rock Music Country Americana Alternative Country Adult Alternative Singer/Songwriter;?;?;293.0;?
Say It Right;?;The Best of Nelly Furtado Deluxe Version;?;?;2010 Geffen Records;223.0;16/11/10
?;?;?;Alternative Music Rock Adult Alternative;1.29;2015 KIDinaKORNER/Interscope Records;85.0;?
Livin Part of Life;Eric Church;Chief / Caught In the Act / Carolina / Sinners Like Me;?;?;?;269.0;17/12/13
Say Something;A Great Big World and Christina Aguilera;?;Pop Music Rock Singer/Songwriter Contemporary Singer/Songwriter Adult Alternative;1.29;2013 2014 Epic Records a division of Sony Music Entertainment;?;17/01/14
Greenlight Bonus Track;?;5 Seconds of Summer Bonus Track Version;Pop Music Teen Pop Alternative Punk Rock;?;?;165.0;22/07/14
I Know You re Gon na Be There;?;?;?;1.29;2011 Capitol Records Nashville All rights reserved Unauthorized reproduction is a violation of applicable laws Manufactured by Capitol Records Nashville 3322 West End Avenue 11th Floor Nashville TN 37203;?;05/08/11
?;?;Believe;?;1.29;2012 The Island Def Jam Music Group;234.0;?
30 for 30 Freestyle;Drake;?;HipHop/Rap Music;?;2015 Cash Money Records Inc With Epic Records a division of Sony Music Entertainment/A1;?;?
?;Document One;UKF Bass Culture 2;Dance Music Electronic;0.99;2012 UKF Music;335.0;?
Steppin Out With My Baby;Tony Bennett;The Classics Deluxe Edition;Vocal Pop Music Vocal;1.29;This compilation P 2013 Columbia Records a division of Sony Music Entertainment;122.0;04/10/13
?;?;1989;Rock Music;1.29;2015 PaxAmericana Recording Company Under Exclusive License To Blue Note Records;263.0;21/09/15
?;Lil Wayne Lil Twist Lil Chuckee Gudda Gudda Jae Millz and Nicki Minaj;?;?;1.29;2010 Cash Money Records Inc;314.0;?
?;The Weeknd;House of Balloons;RandB / Soul Music Contemporary RandB Rock;?;2015 The Weeknd XO Inc;?;17/02/15
Beautiful Now Grey Remix feat Jon Bellion;?;?;Dance Music;1.29;2015 Interscope Records;190.0;11/09/15
?;Meghan Trainor;?;Pop Music Rock Pop/Rock Dance Teen Pop;1.29;?;171.0;?
Goodbye Yellow Brick Road;?;Goodbye Yellow Brick Road 40th Anniversary Celebration Super Deluxe Edition;Rock Music;1.29;2014 Mercury Records Limited;?;24/03/14
Stole My Heart;?;Up All Night;Pop Music Pop/Rock Teen Pop Dance Rock;1.29;?;205.0;13/03/12
Shake It Off;Taylor Swift;?;?;?;?;219.0;?
Music Feels Better Bonus Track;Selena Gomez;?;?;1.29;?;190.0;23/07/13
Home Sweet Home feat Vince Neil;Justin Moore;Nashville Outlaws A Tribute to M  tley Cre;Country Music;1.29;?;?;19/08/14
?;?;The Sound of Madness Deluxe Edition;Rock Music Alternative Grunge Metal Hard Rock;1.29;?;227.0;?
?;Little Mix;Salute;Pop Music Rock Dance Teen Pop;?;2013 Simco Limited under exclusive licence to Sony Music Entertainment UK Limited;207.0;04/02/14
Livin Part of Life;?;Sinners Like Me;?;?;?;?;?
?;Nick Jonas;Nick Jonas Deluxe;Pop Music Rock Pop/Rock;1.29;2014 Island Records a division of UMG Recordings Inc / Safehouse Records LLC;?;?
?;?;Beauty Behind the Madness;RandB / Soul Music;1.29;2015 The Weeknd XO Inc Manufactured and Marketed by Republic Records a Division of UMG Recordings Inc;?;?
Take There feat Kiesza Tchami Remix;Skrillex and Diplo;?;?;?;2014 Atlantic Recording Corporation for the United States and WEA International for the world outside the United States A Warner Music Group Company;273.0;23/12/14
Little Me Unplugged;?;Salute Deluxe Edition;Pop Music;1.29;?;236.0;04/02/14
So Small;Carrie Underwood;?;Country Music Rock Pop Contemporary Country;1.29;2007 19 Recordings Limited;?;22/10/07
Happy Hour Worktape;?;Dirt Road Communion;Country Music;0.99;2012 Dack Janiels Music;463.0;20/03/12
?;Andy Grammer;Good To Be Alive Hallelujah Single;Pop Music;?;2015 SCurve Records;189.0;?
Better Than Words;One Direction;?;Pop Music Rock Pop/Rock Teen Pop Dance;1.29;?;207.0;25/11/13
?;?;Blue Jeans Remixes EP;?;1.29;?;336.0;?
You re Not My God;Keith Urban;?;?;1.29;?;511.0;?
?;?;Settle Deluxe Version;Electronic Music;?;2014 Universal Island Records a division of Universal Music Operations Limited;147.0;?
Please Come to Boston Live;?;When the Sun Goes Down Deluxe Version;?;?;2007 SONY BMG MUSIC ENTERTAINMENT;240.0;02/02/04
Stole My Heart;One Direction;Up All Night;Pop Music Pop/Rock Teen Pop Dance Rock;?;?;205.0;13/03/12
The Sky s the Limit Wideboys Club Mix;Jason Derulo;?;Pop Music RandB / SoulHipHop / Rap Rap Rock Contemporary RandB;1.29;?;421.0;01/07/11
The Sand I Brought To the Beach;Luke Bryan;?;Country Music;1.29;2014 Capitol Records Nashville;206.0;11/03/14
Goodbye to You feat Dot Rotten;?;5;Pop Music Rock Singer/Songwriter Contemporary Singer/Songwriter Adult Alternative;?;2014 Warner Music UK LImited;?;23/06/14
Bad Romance Starsmith Remix;?;The Fame Monster Deluxe Version;Pop Music;?;2014 Interscope Records;295.0;?
Breakn a Sweat Zedd Remix;?;Breakn a Sweat Zedd Remix Single;?;?;?;330.0;07/02/12
The Girls Groove Armada Dub;Calvin Harris;The Girls EP;Dance Music Electronic;0.99;2007 Sony BMG Music Entertainment UK Limited;?;?
Unity Steve Lade Radio Edit;Shinedown;Unity Single;Dance Music Electronic;1.29;2012 Atlantic Recording Corporation for the United States and WEA International Inc for the world outside of the United States;?;24/07/12
?;Shinedown;?;Rock Music Metal Hard Rock Alternative;1.29;2009 Atlantic Recording Corporation for the United States and WEA International Inc for the world outside of the United States;305.0;?
?;?;Doggumentary;HipHop/Rap Music Rock Gangsta Rap West Coast Rap;?;2011 Capitol Records LLC All rights reserved Unauthorized reproduction is a violation of applicable laws Manufactured by Capitol Records LLC 1750 North Vine Street Hollywood CA 90028;?;29/03/11
Old Blue Chair Acoustic Version;Kenny Chesney;Be As You Are;Country Music Contemporary Country Urban Cowboy;1.29;2004 BMG Music;211.0;07/01/05
Stay the Night feat Hayley Williams of Paramore Henry Fong Remix;Zedd;?;?;?;?;248.0;?
?;?;?;RandB / Soul Music Rock Contemporary RandB;1.29;?;258.0;13/11/12
Belong To the World;?;?;?;1.29;?;?;10/09/13
True Colors feat Nicki Minaj;?;Blacc Hollywood;?;?;2014 Atlantic Recording Corporation for the United States and WEA International Inc for the world outside of the United States A Warner Music Group Company;255.0;?
Fake Demo;Shinedown;?;?;?;2009 Atlantic Recording Corporation for the United States and WEA International Inc for the world outside of the United States;?;?
?;?;Magazines or Novels;?;?;2014 SCurve Records;?;05/08/14
?;?;The Road to Here;?;1.29;?;?;?
Take My Drunk Ass Home Demo;Luke Bryan;Spring Break Here to Party;Country Music Contemporary Country;?;2013 Capitol Records Nashville All rights reserved Unauthorized reproduction is a violation of applicable laws Manufactured by Capitol Records Nashville 401 Commerce Street Suite 1100 Nashville TN 37219;202.0;01/03/13
?;Fifth Harmony;Better Together EP;?;0.69;2013 Simco Ltd under exclusive license to Epic Records a division of Sony Music Entertainment;204.0;18/10/13
Old Blue Chair Acoustic Version;Kenny Chesney;?;Country Music Contemporary Country Urban Cowboy;?;?;211.0;?
?;Lana Del Rey;?;Alternative Music Rock Adult Alternative;?;2013 Lana Del Rey under exclusive licence to Polydor Ltd UK Under exclusive licence to Interscope Records in the USA;240.0;?
Reprise Sixteen Going On Seventeen;Carrie Underwood and Ariane Rinehart;The Sound of Music Music from the NBC Television Event;?;1.29;2013 NBCUniversal Media LLC under exclusive license to Sony Masterworks;132.0;?
Sweet Painted Lady;?;Goodbye Yellow Brick Road 40th Anniversary Celebration Super Deluxe Edition;?;?;2014 Mercury Records Limited;?;?
?;?;?;Electronic Music Pop Dance Rock;0.99;2007 SONY BMG MUSIC ENTERTAINMENT UK Limited;?;11/06/07
Bang Bang My Baby Shot Me Down Live from Jazz At Lincoln Center Bonus Track;Lady Gaga;Cheek to Cheek Deluxe Version;Jazz Music Pop Crossover Jazz Vocal Jazz;1.29;?;?;23/09/14
Haunted Acoustic Version;?;Haunted Acoustic Version Single;?;1.29;2010 Big Machine Records LLC;217.0;?
Body Language IR Edit;?;R3HAB Inspired Ministry of Sound;Dance Music;?;?;?;?
?;?;?;Classical Music Opera Soundtrack Rock Classical Crossover Soundtrack;?;?;?;?
Livin Part of Life;?;Chief / Caught In the Act / Carolina / Sinners Like Me;Country Music Rock Southern Rock Contemporary Country;1.29;?;269.0;17/12/13
?;Jason Derulo;Summer Hits;Pop Music;?;2015 BY Music;207.0;?
Toyfriend feat Wynter Gordon Continuous Mix Version;?;?;?;1.29;?;171.0;21/08/09
?;Shinedown;The Sound of Madness Deluxe Edition;?;1.29;2010 Atlantic Recording Corporation for the United States and WEA International Inc for the world outside of the United States;?;24/06/08
Isle of Flightless Birds;?;twenty one pilots;Rock Music Pop;0.99;2009 Twenty One Pilots;345.0;29/12/09
SMH Shakin My Head feat Flo Rida;Detail and Flo Rida;?;HipHop/Rap Music Rap;0.99;?;?;?
Keep the Faith feat Robert Owens;?;?;?;?;2012 UKF Music;248.0;02/09/12
Fly Solo;?;Rolling Papers Deluxe Version;?;?;2011 Atlantic Recording Corporation for the United States and WEA International Inc for the world outside of the United States;?;28/03/11
The Tin Man;?;All I Need to Know;Country Music Urban Cowboy Contemporary Country;0.99;1995 BMG Entertainment;205.0;13/06/95
Dollar Signs feat Tinashe;?;Motion;?;1.29;?;236.0;04/11/14
America s Suitehearts;Fall Out Boy;America s Suitehearts Remixed Retouched Rehabbed and Retoxed EP;?;1.99;?;224.0;28/04/09
We Rest N Cali feat Goldie Loc and Bootsy Collins;Snoop Dogg Bootsy Collins and Goldie Loc;Doggumentary;HipHop/Rap Music Rock Gangsta Rap West Coast Rap;1.29;2011 Capitol Records LLC All rights reserved Unauthorized reproduction is a violation of applicable laws Manufactured by Capitol Records LLC 1750 North Vine Street Hollywood CA 90028;?;?
?;?;?;Dance Music Electronic Rock;?;2009 Sony Music Entertainment Limited under exclusive license to Ultra Records Inc;?;18/08/09
I Do nt Care;?;Folie  Deux Deluxe Version;Alternative Music Punk;1.29;2008 The Island Def Jam Music Group;214.0;?
The Reason Why;Little Big Town;?;?;?;?;292.0;20/08/10
Who Dat Girl Hardwell Instrumental;Flo Rida;Who Dat Girl feat Akon Remixes;DanceMusicHipHop / Rap Rap;1.29;?;324.0;11/01/11
Outversion;?;Version;Pop Music RandB / SoulSoulDanceRockHipHop / RapHipHop Adult Alternative Electronic Pop/Rock;?;2007 Mark Ronson under exclusive license to SONY BMG MUSIC ENTERTAINMENT UK LIMITED;?;10/07/07
Maps for the Getaway;?;?;Alternative Music Rock Pop Pop/Rock Electronic Adult Alternative;1.29;?;237.0;?
Your Mama Should ve Named You Whiskey;Luke Bryan;?;?;1.29;?;222.0;?
Goodbye to You + Dot Rotten;Ed Sheeran;No 5 Collaborations Project;Singer/Songwriter Music Rock Adult Alternative Contemporary Singer/Songwriter;1.29;2010 Paw Print Records under exclusive license to Warner Music UK Limited;?;09/09/11
Bang Bang My Baby Shot Me Down Live from Jazz At Lincoln Center Bonus Track;Lady Gaga;Cheek to Cheek;Jazz Music Vocal Vocal Pop Standards Rock Crossover Jazz Contemporary Jazz Easy Listening Swing Vocal Jazz Traditional Pop;?;?;?;23/09/14
?;?;Take It to the Bank EP;Country Music;1.29;?;?;?
Lick It Kaz James Remix;?;Lick It Kaz James Remix Single;?;1.29;?;360.0;22/05/12
X2CU;Jason Derulo;?;?;1.29;?;313.0;01/06/15
?;Willie Nelson;Moment of Forever;Country Music Rock Traditional Country Contemporary Country Outlaw Country Pop Pop/Rock Honky Tonk Singer/Songwriter;0.99;?;?;28/01/08
Through the Ghost;?;The Studio Album Collection;Rock Music;1.29;2013 Atlantic Recording Corporation for the United States and WEA International Inc for the world outside of the United States A Warner Music Group Company;241.0;08/11/13
?;One Direction;?;Pop Music Rock Pop/Rock Teen Pop Dance;?;2013 Simco Limited under exclusive license to Sony Music Entertainment UK Limited;207.0;?
Margaret;Danny Elfman;?;Soundtrack Music;?;?;?;?
The Drugs Not Working;?;?;Rock Music Adult Alternative;?;2014 UMG Recordings Inc;?;04/11/03
Anything Could Happen Guy Scheiman TLV Club Remix;Ellie Goulding;?;?;1.29;?;465.0;?
Goodbye to You feat Dot Rotten;?;?;?;1.29;2014 Warner Music UK LImited;?;23/06/14
Lolita;?;?;Alternative Music Rock Adult Alternative;1.29;2012 Lana Del Rey under exclusive licence to Polydor Ltd UK Under exclusive licence to Interscope Records in the USA;220.0;13/11/12
?;The Weeknd;?;RandB / Soul Music Contemporary RandB Rock;?;2015 The Weeknd XO Inc;286.0;?
Thinking About You feat Ayah Marar;Calvin Harris;18 Months;Dance Music House Rock Electronic;?;2012 Sony Music Entertainment UK under exclusive license to Ultra Music / Roc Nation / Columbia Records;247.0;30/10/12
You re Not My God;?;?;Country Music Honky Tonk Contemporary Country;1.29;2002 Capitol Records Nashville;511.0;?
Goodbye to You + Dot Rotten;Ed Sheeran;?;Singer/Songwriter Music Rock Adult Alternative Contemporary Singer/Songwriter;?;?;?;?
?;Jason Derulo;?;Pop Music RandB / SoulRockHipHop / Rap Rap Contemporary RandB Dance;1.29;2010 Warner Bros Records Inc for the U S and WEA International Inc for the world outside the U S;?;26/02/10
?;Nick Jonas;?;?;1.29;?;?;10/11/14
?;?;Believe Acoustic;Pop Music Rock Vocal Teen Pop;?;?;?;29/01/13
In the Bathtub;Geoff Zanelli and Mark Ronson;Mortdecai Music from the Motion Picture;?;?;2015 Lions Gate Records Inc;143.0;20/01/15
?;twenty one pilots;Vessel;Alternative Music Rock Indie RockHipHop / Rap Rap Underground Rap;1.29;2012 Fueled By Ramen LLC for the United States and WEA International Inc for the world outside of the United States;142.0;04/01/13
This Love Karaoke Version;Taylor Swift;Taylor Swift Karaoke 1989;Pop Music;1.29;?;247.0;?
Champagne for My Real Friends Real Pain for My Sham Friends;Fall Out Boy;From Under the Cork Tree;?;0.99;2005 The Island Def Jam Music Group;203.0;03/05/05
?;?;Taylor Swift Karaoke Red;?;?;?;?;05/02/13
Goodbye to You feat Dot Rotten;Ed Sheeran;5;?;1.29;2014 Warner Music UK LImited;330.0;23/06/14
Sexxx Dreams;Lady Gaga;?;?;1.29;2013 Interscope Records;?;11/11/13
Medicated feat Chevy Woods and Juicy J;Wiz Khalifa;?;HipHop/Rap Music Hardcore Rap East Coast Rap Rap;1.29;?;330.0;?
?;Keith Urban;Fuse;?;1.29;?;232.0;10/09/13
You re Not My God;Keith Urban;?;Country Music Honky Tonk Contemporary Country;?;?;?;04/10/02
?;?;Blacc Hollywood;HipHop/Rap Music Rap Hardcore Rap East Coast Rap Rock;?;2014 Atlantic Recording Corporation for the United States and WEA International Inc for the world outside of the United States A Warner Music Group Company;?;?
Sweat Snoop Dogg vs David Guetta Remix;?;?;HipHop/Rap Music;1.29;?;?;?
?;Ed Sheeran;?;Singer/Songwriter MusicFolkRock Rock Adult Alternative Singer/Songwriter Contemporary Singer/Songwriter;?;2011 Warner Music UK Limited;526.0;?
Goner;twenty one pilots;Blurryface;Alternative Music Rock Adult Alternative Indie RockHipHop / Rap Rap Underground Rap;1.29;2015 Fueled By Ramen LLC for the United States and WEA International Inc for the world outside of the United States A Warner Music Group Company;236.0;?
?;Lucas Nord;Hed Kandi Deep Disco;Dance Music;1.29;2014 Hed Kandi Records/Ministry of Sound Recordings Ltd;244.0;25/01/15
