Spring Breakdown;Luke Bryan;Spring Break Checkin Out 5 Song EP;?;1.29;2015 Capitol Records Nashville;226.0;10/03/15
In the Bathtub;Geoff Zanelli and Mark Ronson;Mortdecai Music from the Motion Picture;Soundtrack Music Original Score Soundtrack Classical;1.29;?;143.0;20/01/15
The Middle;Lauren Alaina;Wildflower;Country Music Rock Contemporary Country;1.29;2011 19 Recordings Inc;236.0;11/10/11
?;Danny Elfman;Nightmare Before Christmas Special Edition;Soundtrack Music;1.29;2006 Walt Disney Records;283.0;24/10/06
Livin Part of Life;Eric Church;Sinners Like Me;?;1.29;2006 Capitol Records Nashville All rights reserved Unauthorized reproduction is a violation of applicable laws Manufactured by Capitol Records Nashville 3322 West End Avenue 11th Floor Nashville TN 37203;269.0;?
Fake Demo;?;Us and Them Deluxe Version;?;?;2009 Atlantic Recording Corporation for the United States and WEA International Inc for the world outside of the United States;305.0;04/10/05
?;Jason Derulo;?;?;1.29;?;313.0;?
VHS Outro Interlude;?;VHS;Alternative Music Rock Adult Alternative;?;2015 KIDinaKORNER/Interscope Records;85.0;30/06/15
As Long As You Love Me feat Big Sean Audien Luvstep Mix;Justin Bieber;As Long As You Love Me Remixes feat Big Sean;?;1.29;2012 The Island Def Jam Music Group;?;11/09/12
Goodbye to You + Dot Rotten;Ed Sheeran;?;Singer/Songwriter Music Rock Adult Alternative Contemporary Singer/Songwriter;?;2010 Paw Print Records under exclusive license to Warner Music UK Limited;?;09/09/11
?;Fall Out Boy;Thnks Fr Th Mmrs Remix EP;Dance Music Alternative Punk Electronic;1.29;?;396.0;?
?;Disclosure;Settle Deluxe Version;Electronic Music;1.29;2014 Universal Island Records a division of Universal Music Operations Limited;61.0;15/04/14
Stayin Out All Night Boys of Zummer Remix;Wiz Khalifa and Fall Out Boy;Stayin Out All Night Boys of Zummer Remix Single;HipHop/Rap Music Rap;?;?;265.0;31/07/15
?;Calvin Harris;You Used to Hold Me EP;Dance Music Electronic Rock;?;?;?;09/02/10
?;?;+;Singer/Songwriter MusicFolkRock Rock Adult Alternative Singer/Songwriter Contemporary Singer/Songwriter;1.29;2011 Warner Music UK Limited;?;09/09/11
Songs Like This;Carrie Underwood;Play On;Country Music Pop Adult Contemporary Contemporary Country Rock;?;?;157.0;03/11/09
F For You;Disclosure;Settle Deluxe Version;?;?;2014 Universal Island Records a division of Universal Music Operations Limited;269.0;?
Elevator feat Timbaland;Flo Rida;Mail On Sunday Deluxe Version;HipHop/Rap Music Dirty South;1.99;2008 Atlantic Recording Corporation for the United States and WEA International Inc for the world outside of the United States;235.0;?
Nothing Would Be Better;Nick Jonas;Nick Jonas;Pop Music Pop/Rock Rock;1.29;2014 Island Records a division of UMG Recordings Inc / Safehouse Records LLC;?;10/11/14
Everything Is Not As It Seems Series Theme Song;Selena Gomez;?;Soundtrack Music TV Soundtrack Children s Music;1.29;2009 Disney;50.0;04/08/09
?;Maddie and Tae;Start Here;Country Music Rock Contemporary Country Pop Pop/Rock Honky Tonk;1.29;2015 Republic Records a Division of UMG Recordings Inc Dot Records;200.0;28/08/15
Every Time You Go;Ellie Goulding;Bright Lights Deluxe Version;Pop Music Dance Rock;1.29;?;205.0;29/11/10
Saturday Live;Fall Out Boy;Live In Phoenix;Alternative Music Rock Adult Alternative Punk;0.99;2008 The Island Def Jam Music Group;?;01/04/08
In the Bathtub;?;?;Soundtrack Music Original Score Soundtrack Classical;?;2015 Lions Gate Records Inc;?;20/01/15
?;Eminem;Relapse Refill;HipHop/Rap Music Rap Hardcore Rap;1.29;2009 Aftermath Records;392.0;?
I ve Got All This Ringing In My Ears and None On My Fingers;Fall Out Boy;Infinity On High;?;0.99;?;?;06/02/07
Hurt;Ken Jeong;?;?;1.29;?;?;21/05/13
On My Level feat Too hort;Wiz Khalifa;?;HipHop/Rap Music Hardcore Rap East Coast Rap Rap;1.29;?;?;28/03/11
Glitter In the Air Main Version;?;Funhouse;?;1.29;?;?;28/10/08
Connect;Drake;Nothing Was the Same;?;1.29;2013 Cash Money Records Inc;?;24/09/13
Stole My Heart;One Direction;?;Pop Music Pop/Rock Teen Pop Dance Rock;1.29;Track 2 P 2012 all other tracks P 2011 Simco Limited Under exclusive license to Sony Music Entertainment UK Limited;205.0;13/03/12
Inside Your Heaven;?;?;Pop Music Rock Country Contemporary Country Adult Contemporary;?;?;224.0;14/11/05
Isle of Flightless Birds;twenty one pilots;twenty one pilots;Rock Music Pop;0.99;2009 Twenty One Pilots;345.0;29/12/09
Jack Daniels Live;Eric Church;Caught In the Act Live;?;?;2013 EMI Records Nashville All rights reserved Unauthorized reproduction is a violation of applicable laws Manufactured by Capitol Records Nashville 401 Commerce Street Suite 1100 Nashville TN 37219;271.0;05/04/13
Reprise DoReMi The Concert;?;The Sound of Music Music from the NBC Television Event;Soundtrack Music;?;2013 NBCUniversal Media LLC under exclusive license to Sony Masterworks;?;?
I Wish You Would Karaoke Version;Taylor Swift;?;Pop Music;1.29;2014 Big Machine Records LLC;204.0;03/03/15
Heart Like Mine;?;Fuse;Country Music Honky Tonk Contemporary Country;1.29;2013 Hit Red Records under exclusive license to Capitol Records Nashville;232.0;10/09/13
Truce;twenty one pilots;Vessel;Alternative Music Rock Indie RockHipHop / Rap Rap Underground Rap;1.29;2012 Fueled By Ramen LLC for the United States and WEA International Inc for the world outside of the United States;?;04/01/13
Finale;?;Disney Classics;?;1.29;?;?;?
Ass On the Floor feat Swizz Beatz;?;Last Train to Paris;HipHop/Rap Music RandB / Soul Contemporary RandB Dance Rap;1.29;2010 Bad Boy/Interscope Records;244.0;14/12/10
?;Andy Grammer;Andy Grammer;Pop Music Rock Adult Alternative;1.29;2011 SCurve Records;203.0;14/06/11
Pancho and Lefty;Luke Bryan and Dierks Bentley;?;Country Music;1.29;2014 Broken Bow Records;297.0;01/04/14
Burning Down the House Live;?;Tightrope EP;Alternative Music Rock Indie Rock;1.29;2013 RCA Records a division of Sony Music Entertainment;231.0;?
Brave Honest Beautiful feat Meghan Trainor;?;?;Pop Music RandB / Soul Dance Teen Pop Rock;?;?;?;30/01/15
Night Light Running Trax Summer 60 Min Mix Joe Goddard Remix;Jessie Ware;Running Trax Summer 2013 Ministry of Sound;Fitness and Workout Music Pop;1.29;2013 Ministry of Sound Recordings Limited;331.0;08/07/13
You ll Think of Me;Keith Urban;?;?;?;This compilation 2007 Capitol Records Nashville All rights reserved Unauthorized reproduction is a violation of applicable laws Manufactured by Capitol Records Nashville 3322 West End Avenue 11th Floor Nashville TN 37203;231.0;08/01/08
Miracle Mile;Cold War Kids;Miracle Mile Single;Alternative Music Rock;?;?;180.0;05/02/13
Every Time You Go Live at the iTunes Festival;Ellie Goulding;?;?;1.29;2010 Polydor Ltd UK;220.0;29/11/10
Livin Part of Life;Eric Church;Chief / Caught In the Act / Carolina / Sinners Like Me;Country Music Rock Southern Rock Contemporary Country;1.29;?;?;17/12/13
Ai nt Back Yet;Kenny Chesney;Greatest Hits II;Country Music Urban Cowboy Contemporary Country;1.29;2010 Sony Music Entertainment;239.0;?
Make It Up As We Go;Jason Derulo;?;Pop Music Rock;1.29;2011 Warner Bros Records Inc;190.0;?
Georgia Woods;Keith Urban;Get Closer Deluxe Version;Country Music Honky Tonk Pop Pop/Rock Contemporary Country Rock;1.29;?;317.0;22/02/11
Front Porch Thing;Little Big Town;Tornado;?;?;?;206.0;07/09/12
?;?;What Do You Mean Single;Pop Music Rock;1.29;2015 Def Jam Recordings a division of UMG Recordings Inc;207.0;28/08/15
?;Disclosure;?;Alternative Music;0.99;2010 Moshi Moshi Records;299.0;29/08/10
Human;Zedd and Nicky Romero;Spectrum EP;Dance Music Electronic House;1.29;2012 Interscope Records;257.0;31/07/12
Beats a Million Bucks;Chase Rice;Country As Me;Country Music Rock;?;2011 Artist Revolution;?;08/03/11
Sugar Live;Flo Rida;?;HipHop/Rap Music;?;2009 Atlantic Recording Corporation for the United States and WEA International Inc for the world outside of the United States;234.0;30/03/09
?;Major Lazer;Peace Is The Mission;Electronic Music Reggae Modern Dancehall Dance;?;2015 Mad Decent;229.0;01/06/15
Curiosity;Carly Rae Jepsen;Kiss;Pop Music Rock Vocal Dance Teen Pop World;1.29;?;213.0;18/09/12
Some Day;?;Us and Them;Rock Music Metal Alternative Hard Rock;1.29;2005 Atlantic Recording Corp For the United States and WEA International Inc for the world outside of the United States;?;04/10/05
Recess feat Fatman Scoop and Michael Angelakos Flux Pavilion Remix;Skrillex and Kill the Noise;Recess Remixes EP;?;1.29;?;227.0;07/07/14
Waltz;?;?;Soundtrack Music;1.29;2013 The Contest LLC;222.0;30/09/13
?;Mark Ronson;Version;Pop Music RandB / SoulSoulDanceRockHipHop / RapHipHop Adult Alternative Electronic Pop/Rock;0.99;2007 Mark Ronson under exclusive license to SONY BMG MUSIC ENTERTAINMENT UK LIMITED;112.0;10/07/07
Young Wild and Free feat Bruno Mars;Snoop Dogg;Mac and Devin Go to High School Music from and Inspired By the Movie Deluxe Version;SoundtrackMusicHipHop / Rap Hardcore Rap Gangsta Rap West Coast Rap Rap Soundtrack;1.99;?;252.0;12/12/11
We Are Monster High Madison Beer Version;Madison Beer;We Are Monster High Madison Beer Version Single;Children s Music Music Pop;1.29;?;?;06/06/13
Stay the Night feat Hayley Williams of Paramore;Zedd;?;?;?;2013 Interscope Records;?;?
?;Ken Page Ed Ivory Oogie Boogie and Chorus Nightmare Before Christmas;Nightmare Before Christmas Special Edition;Soundtrack Music;1.29;2006 Walt Disney Records;?;24/10/06
Closer feat Mike Posner;Nick Jonas;Nick Jonas Deluxe Version;?;1.29;2014 Island Records a division of UMG Recordings Inc / Safehouse Records LLC;?;10/11/14
?;Famous to Most;Furious 7 Original Motion Picture Soundtrack;?;?;This compilation 2015 Universal Studios and Atlantic Recording Corporation for the United States and WEA International Inc for the world outside of the United States;220.0;17/03/15
?;?;?;Country Music Honky Tonk Traditional Country Contemporary Country;?;2013 Atlantic Recording Corporation for the United States and WEA International Inc for the world outside of the United States;?;?
You Do nt Know Me;Ariana Grande;?;Pop Music World Rock RandB / Soul Contemporary RandB Dance;1.29;2014 Republic Records a division of UMG Recordings Inc;?;?
Starlight;Taylor Swift;?;Country Music Rock Contemporary Country Honky Tonk Pop Teen Pop;1.29;?;220.0;22/10/12
?;?;Clarity Deluxe Edition;Dance Music;1.29;2013 Interscope Records;225.0;24/09/13
?;Wiz Khalifa;Say Yeah Single;HipHop/Rap Music East Coast Rap Hardcore Rap;?;2008 Warner Bros Records Inc for the U S and WEA International Inc for the world outside the U S;?;?
Beauty and a Beat DJ Laszlo Body Rock Instrumental;Justin Bieber;Beauty and a Beat Remixes feat Nicki Minaj;Dance Music Rock Electronic;?;2012 The Island Def Jam Music Group;451.0;10/12/12
Rolling Stone;The Weeknd;?;?;1.29;2012 XO and co Inc;?;13/11/12
?;Kenny Chesney;?;Country Music Contemporary Country Urban Cowboy;?;2004 Sony Music Entertainment;203.0;01/01/90
Because of Your Love;?;?;Country Music Contemporary Country Urban Cowboy;0.99;2000 BMG Entertainment;256.0;26/09/00
Love Song;PNK;?;Pop Music Teen Pop Electronic Pop/Rock RandB / Soul Dance;0.99;2003 Arista Records Inc;148.0;10/11/03
Starry Eyed;Ellie Goulding;Bright Lights Deluxe Version;?;1.29;2010 Polydor Ltd UK;176.0;29/11/10
Lifted feat Emeli Sand  and Professor Green;Naughty Boy;Hotel Cabana Deluxe Version;Pop Music Rock RandB / Soul Contemporary RandB DanceElectronicHipHop / Rap Pop/Rock;1.29;?;?;06/05/14
Livin Part of Life;?;?;?;1.29;2013 Capitol Nashville;?;?
Worry B Gone;?;Moment of Forever;Country Music Rock Traditional Country Contemporary Country Outlaw Country Pop Pop/Rock Honky Tonk Singer/Songwriter;0.99;2008 UMG Recordings Inc;187.0;28/01/08
Downtown feat Eric Nally Melle Mel Kool Moe Dee and Grandmaster Caz;Macklemore and Ryan Lewis;?;?;1.29;2015 Macklemore LLC;292.0;?
A Little Less 16 Candles a Little More Touch Me;Fall Out Boy;?;Alternative Music Rock Punk;1.99;?;?;20/06/06
The Sand I Brought To the Beach;Luke Bryan;Spring Break 6 Like We Ai nt Ever EP;Country Music;1.29;?;206.0;?
The Fall;The Weeknd;Trilogy;?;?;2012 XO and co Inc;345.0;13/11/12
Little Me Unplugged;?;?;Pop Music;1.29;?;?;04/02/14
Isle of Flightless Birds;?;twenty one pilots;Rock Music Pop;0.99;2009 Twenty One Pilots;345.0;29/12/09
Shocker;Tisto and Dj Punish;Club Life Vol 3 Stockholm;Dance Music Trance Electronic;1.29;?;410.0;18/06/13
?;?;?;?;?;2013 Big Machine Label Group LLC;224.0;25/11/13
Little Me Unplugged;?;Salute Deluxe Edition;?;1.29;2013 Simco Limited under exclusive licence to Sony Music Entertainment UK Limited;236.0;?
This Is What It Takes;?;?;Pop Music Rock Vocal Dance Teen Pop;1.29;2015 Island Records a division of UMG Recordings Inc;230.0;14/04/15
Through the Ghost;?;The Studio Album Collection;Rock Music;?;2013 Atlantic Recording Corporation for the United States and WEA International Inc for the world outside of the United States A Warner Music Group Company;241.0;?
Because of Your Love;Kenny Chesney;Greatest Hits;?;0.99;2000 BMG Entertainment;256.0;26/09/00
I Wo nt Give Up;Jana Kramer;Jana Kramer;Country Music Honky Tonk Contemporary Country;1.29;?;?;?
Dirt Road Diary;Luke Bryan;?;?;1.29;2013 Capitol Records Nashville;?;13/08/13
?;One Direction;Midnight Memories Deluxe Edition;Pop Music Rock Teen Pop Pop/Rock Dance;1.29;2013 Simco Limited under exclusive license to Sony Music Entertainment UK Limited;200.0;?
?;Ellie Goulding;Halcyon Days Deluxe Edition;Pop Music Dance Rock;?;2013 Polydor Ltd UK;?;27/08/13
Valerie;?;Thursday;RandB / Soul Music Contemporary RandB Rock;1.29;?;?;17/02/15
?;Zedd;?;?;1.29;2012 Dim Mak Inc;?;20/05/14
?;Ed Sheeran;x;Singer/Songwriter Music Pop Rock Contemporary Singer/Songwriter Adult Alternative;?;2014 Asylum Records UK a Warner Music UK Company;?;?
Art Deco;?;Honeymoon;Alternative Music Rock Adult Alternative;?;2015 Polydor Ltd UK;295.0;18/09/15
The Back Roads and the Back Row;Cole Swindell;Cole Swindell;Country Music Contemporary Country;1.29;?;?;?
VHS Outro Interlude;X Ambassadors;?;Alternative Music Rock Adult Alternative;1.29;?;85.0;30/06/15
Crew Love feat The Weeknd;?;?;HipHop/Rap Music;?;2011 Cash Money Records Inc;?;15/11/11
Uptown Funk feat Bruno Mars Will Sparks Remix;Mark Ronson;Uptown Funk Remixes EP;Pop Music Rock;?;2015 Sony Music Entertainment UK Limited;?;13/04/15
?;Jason Derulo;Jason Derulo Special Edition EP;Pop Music RandB / SoulHipHop / Rap Rap Rock Contemporary RandB;1.29;2010 Warner Bros Records Inc;421.0;?
Act My Age;?;?;Pop Music;?;?;?;17/11/14
?;Eric Church;?;?;1.29;2013 Capitol Nashville;269.0;17/12/13
?;?;?;?;1.29;?;309.0;16/11/10
?;Zedd;Beautiful Now feat Jon Bellion Remixes EP;Dance Music;1.29;?;255.0;10/07/15
Hopes and Dreams;?;?;?;1.29;?;238.0;28/03/11
?;?;Nico Canada Presenta a lo Under Vol 1 Perreo Perreo;?;0.99;2012 White Lion Music;?;19/07/12
Suburbia;Ryan Adams;Vampires Paxam Singles Series Volume 3 EP;Rock Music Adult Alternative;1.29;?;143.0;?
Mashup the Dance feat The Partysquad and Ward 21;Major Lazer;?;Electronic Music Rock Reggae Modern Dancehall Dance;1.29;?;229.0;18/06/13
We re Dancing Alex Ghenea 3 0 Remix;Bridgit Mendler;?;Soundtrack Music Soundtrack Pop;1.29;2013 Walt Disney Records;201.0;?
You  re Never Over;Eminem;Recovery;HipHop/Rap Music Rock Hardcore Rap Rap;1.29;2010 Aftermath Records;305.0;21/06/10
I Told You So;?;Carnival Ride;Country Music Rock Pop Contemporary Country;1.29;2007 19 Recordings Limited;?;22/10/07
?;The Mavericks;Nashville Outlaws A Tribute to M  tley Cre;Country Music;?;?;313.0;?
Round Here;?;Here s To the Good Times This Is How We Roll Deluxe Version;Country Music Urban Cowboy Honky Tonk Contemporary Country;1.29;2013 Big Machine Label Group LLC;215.0;25/11/13
Old Blue Chair Acoustic Version;Kenny Chesney;Be As You Are;Country Music Contemporary Country Urban Cowboy;1.29;2004 BMG Music;211.0;?
Jump Disco Fries Extended Mix;Flo Rida;Jump Remixes feat Nelly Furtado;DanceMusicElectronicHipHop / Rap Dirty South;1.29;?;?;?
GDFR feat Sage the Gemini and Lookas K Theory Remix;?;?;?;1.29;?;187.0;21/01/15
Picture to Burn Live;Taylor Swift;?;Country Music Pop Teen Pop Contemporary Country;?;2007 Big Machine Records LLC All Rights Reserved;213.0;15/01/08
Bang Bang My Baby Shot Me Down Live from Jazz At Lincoln Center Bonus Track;Lady Gaga;?;?;1.29;2014 Columbia Records a division of Sony Music Entertainment / Interscope Records a division of UMG Recordings Inc;?;23/09/14
Is It Love;PNK;Ca nt Take Me Home;Pop Music Dance RandB / Soul Pop/Rock Teen Pop Contemporary RandB;0.99;1999 2000 LaFace Records LLC;218.0;05/05/97
?;Jason Derulo;?;Pop Music RandB / Soul Contemporary RandB Dance Rock;?;2013 2014 Warner Bros Records Inc;225.0;15/04/14
Somebody to Love Remix feat Usher;Justin Bieber;Never Say Never The Remixes;Pop Music Teen Pop Dance Rock Vocal;1.29;2011 The Island Def Jam Music Group;?;?
I Ca nt Take It Party Favor Remix;Dillon Francis;This Mixtape Is Fire;Dance Music Electronic;?;2015 Columbia Records a Division of Sony Music Entertainment;241.0;14/08/15
Find You feat Matthew Koma and Miriam Bryant Mike Hawkins Remix;?;?;Dance Music Electronic;1.29;?;266.0;?
?;Nick Jonas;Nick Jonas Deluxe Version;Pop Music Teen Pop Pop/Rock Rock;1.29;?;228.0;10/11/14
The Mathlete Rap;?;Mean Girls Original Motion Picture Soundtrack;Soundtrack Music;?;?;35.0;?
?;Flo Rida;?;?;0.99;2007 Atlantic Recording Corporation for the United States and WEA International Inc for the world outside of the United States;?;04/12/07
?;?;My Worlds Acoustic;Pop Music Vocal RandB / Soul Contemporary RandB Rock Teen Pop;1.29;2011 The Island Def Jam Music Group;198.0;08/02/11
Underage;?;The First Time;Country Music Contemporary Country Honky Tonk Rock;?;2015 Black River Entertainment;190.0;18/05/15
Your Mama Should ve Named You Whiskey;?;Crash My Party Deluxe;Country Music Contemporary Country;1.29;?;?;12/08/14
?;Calvin Harris;I Created Disco;Dance Music RandB / Soul Disco Electronic Rock;?;2007 SONY BMG MUSIC ENTERTAINMENT UK Limited;?;18/06/07
Isle of Flightless Birds;twenty one pilots;twenty one pilots;Rock Music Pop;?;2009 Twenty One Pilots;345.0;29/12/09
We re All the Same;Calvin Harris;?;Dance Music RandB / Soul Disco Electronic Rock;0.99;?;236.0;18/06/07
It s All Your Fault Live;PNK;Funhouse Tour Live In Australia;Pop Music Dance RandB / Soul Pop/Rock;?;2009 RCA/JIVE Label Group a unit of Sony Music Entertainment;?;26/10/09
?;Skrillex;Recess;Dance Music Electronic Rock;1.29;?;342.0;?
Paparazzi;Lady Gaga;The Fame Monster Deluxe Version;Pop Music;1.29;2014 Interscope Records;?;05/08/14
?;Calvin Harris;?;?;0.99;?;?;11/06/07
?;Elton John;?;Rock Music;1.29;2014 Mercury Records Limited;233.0;24/03/14
Scarecrows;Luke Bryan;?;Country Music Rock Contemporary Country;1.29;2015 Capitol Records Nashville;?;?
It s d Only Thang;Snoop Dogg;Doggumentary;HipHop/Rap Music Rock Gangsta Rap West Coast Rap;1.29;?;196.0;29/03/11
Through the Ghost;Shinedown;?;Rock Music;1.29;2013 Atlantic Recording Corporation for the United States and WEA International Inc for the world outside of the United States A Warner Music Group Company;241.0;?
?;The Chainsmokers;Kanye Remixes Pt 1 feat sirenXX Single;Electronic Music;1.29;2014 Dim Mak Inc under exclusive license to Republic Records a Division of UMG Recordings Inc;242.0;21/10/14
Valerie;The Weeknd;Thursday;RandB / Soul Music Contemporary RandB Rock;?;2015 The Weeknd XO Inc;286.0;17/02/15
Whatcha Got In That Cup;Thomas Rhett;It Goes Like This;?;?;?;177.0;29/10/13
I Wo nt Give Up;Jana Kramer;?;Country Music Honky Tonk Contemporary Country;1.29;2012 Warner Music Nashville LLC and WEA International Inc for the world outside the U S;?;?
Extra Extra Credit;?;Flight School;?;0.99;2009 Rostrum Records;243.0;17/04/09
?;WALK THE MOON;?;Alternative Music Indie Rock Rock;1.29;2014 RCA Records a division of Sony Music Entertainment;217.0;28/11/14
?;Little Big Town;Pain Killer;Country Music Honky Tonk Contemporary Country;1.29;?;213.0;21/10/14
?;Chase Rice;Ignite the Night;Country Music Urban Cowboy Contemporary Country;1.29;?;?;19/08/14
The Sound of Music;?;The Sound of Music Music from the NBC Television Event;?;1.29;2013 NBCUniversal Media LLC under exclusive license to Sony Masterworks;?;?
Till Dawn Here Comes the Sun;?;Trilogy;RandB / Soul Music Rock Contemporary RandB;1.29;?;?;13/11/12
See You Again;Elle King;Love Stuff;Alternative Music Rock;?;2014 RCA Records a division of Sony Music Entertainment;206.0;13/02/15
Isle of Flightless Birds;twenty one pilots;twenty one pilots;Rock Music Pop;0.99;2009 Twenty One Pilots;345.0;29/12/09
There s an Angel Floating Round This House Live;Brian Kennedy;?;?;1.29;2013 Union Square Music Ltd;?;25/02/13
One Click Headshot;?;UKF Bass Culture 2;Dance Music Electronic;0.99;?;287.0;02/09/12
Fear;Drake;?;HipHop/Rap Music Pop RandB / Soul Contemporary RandB Hardcore Rap Dirty South;1.29;2009 Young Money Entertainment/Cash Money Records/Universal Motown;280.0;15/09/08
?;?;Funhouse Tour Live In Australia;Pop Music Dance RandB / Soul Pop/Rock;?;2009 RCA/JIVE Label Group a unit of Sony Music Entertainment;?;?
?;?;Word Up Single;Pop Music;?;2014 Simco Limited under exclusive license to Sony Music Entertainment UK Limited;209.0;14/03/14
?;?;?;Alternative Music Indie Rock Rock;1.29;2014 Downtown Records;208.0;11/09/15
The Sky s the Limit Wideboys Club Mix;Jason Derulo;Jason Derulo Special Edition EP;Pop Music RandB / SoulHipHop / Rap Rap Rock Contemporary RandB;?;?;421.0;?
?;Little Big Town;Pain Killer;Country Music Honky Tonk Contemporary Country;1.29;2014 Little Big Town LLC Under exclusive license to Capitol Records Nashville;?;21/10/14
Cameras;Wiz Khalifa;?;HipHop/Rap Music Hardcore Rap East Coast Rap Rap;1.29;?;269.0;28/03/11
Please Come to Boston Live;Kenny Chesney;When the Sun Goes Down Deluxe Version;?;?;2007 SONY BMG MUSIC ENTERTAINMENT;240.0;02/02/04
?;LMFAO;?;?;1.29;?;?;21/06/11
Tus Desprecios;Selena;Enamorada de Ti;Regional Mexicano Music Latino Latin Pop;1.29;?;?;30/03/12
?;Kenny Chesney;Just Who I Am Poets and Pirates;Country Music Contemporary Country;0.99;?;329.0;08/09/07
All This Could Be Yours Return to Tackyland;Cold War Kids;Hold My Home Deluxe Edition;Alternative Music Indie Rock Rock;1.29;2014 Downtown Records;199.0;?
Birds;Holly Williams;Here With Me;?;0.99;2009 Mercury Records a Division of UMG Recordings Inc;155.0;16/06/09
Thought of You;Justin Bieber;?;?;1.29;2012 The Island Def Jam Music Group;230.0;?
?;Ed Sheeran;+;Singer/Songwriter MusicFolkRock Rock Adult Alternative Singer/Songwriter Contemporary Singer/Songwriter;1.29;2011 Warner Music UK Limited;526.0;09/09/11
?;Wiz Khalifa;Blacc Hollywood Deluxe Version;?;?;?;?;19/08/14
Save Me Pull Mix;Shinedown;?;?;1.29;2006 Atlanic Recording Corp for the United States and WEA International Inc for the world outside of the United States;259.0;?
Concert Intro Live;PNK;Funhouse Tour Live In Australia;Pop Music Dance RandB / Soul Pop/Rock;1.99;2009 RCA/JIVE Label Group a unit of Sony Music Entertainment;?;26/10/09
Dance Dance;?;From Under the Cork Tree Limited Black Clouds and Underdogs Edition EP;?;1.99;2006 The Island Def Jam Music Group;?;?
Corn;Chris Janson;Chris Janson EP;Country Music;0.99;2013 Bigger Picture LLC/Better I Do nt LLC;234.0;03/09/13
Outversion;Mark Ronson;Version;Pop Music RandB / SoulSoulDanceRockJazzHipHop / RapElectronicHipHop Pop/Rock Adult Alternative;?;2007 Mark Ronson under exclusive license to SONY BMG MUSIC ENTERTAINMENT UK Limited except Track 9 P 2006 Rapster Records / BBE Records;110.0;?
F for You;?;Settle;Electronic Music Dance Garage House Rock;1.29;2013 Universal Island Records a division of Universal Music Operations Limited;269.0;04/06/13
?;Flo Rida;iTunes Festival London 2009 EP;HipHop/Rap Music;1.29;?;?;?
I Can Fly;Lana Del Rey;Big Eyes Music from the Original Motion Picture;?;1.29;2014 Interscope Records;348.0;23/12/14
?;5 Seconds of Summer;5 Seconds of Summer Bonus Track Version;Pop Music Teen Pop Alternative Punk Rock;1.29;2014 Capitol Records Ltd;165.0;22/07/14
?;Chase Rice;Dirt Road Communion;Country Music;0.99;2012 Dack Janiels Music;463.0;?
You re Not Sorry Instrumental With Background Vocals;?;Taylor Swift Karaoke Fearless Instrumentals With Background Vocals;Country Music;0.99;?;264.0;07/04/09
Voices;Ryan Adams;29;Rock Music Country Americana Alternative Country Adult Alternative Singer/Songwriter;?;2005 UMG Recordings Inc;?;20/12/05
Say It Right;Nelly Furtado;The Best of Nelly Furtado Deluxe Version;Pop Music Rock Vocal Adult Alternative Singer/Songwriter Contemporary Singer/Songwriter;0.99;2010 Geffen Records;223.0;16/11/10
VHS Outro Interlude;X Ambassadors;VHS;?;?;2015 KIDinaKORNER/Interscope Records;?;30/06/15
?;Eric Church;Chief / Caught In the Act / Carolina / Sinners Like Me;Country Music Rock Southern Rock Contemporary Country;1.29;2013 Capitol Nashville;?;17/12/13
Say Something;A Great Big World and Christina Aguilera;Is There Anybody Out There;?;1.29;2013 2014 Epic Records a division of Sony Music Entertainment;?;17/01/14
Greenlight Bonus Track;5 Seconds of Summer;?;Pop Music Teen Pop Alternative Punk Rock;1.29;2014 Capitol Records Ltd;165.0;22/07/14
I Know You re Gon na Be There;?;Tailgates and Tanlines;Country Music Contemporary Country;1.29;?;216.0;?
?;Justin Bieber;?;?;?;?;?;19/06/12
30 for 30 Freestyle;Drake;What a Time To Be Alive;?;?;?;253.0;20/09/15
?;Document One;UKF Bass Culture 2;?;0.99;2012 UKF Music;?;?
Steppin Out With My Baby;Tony Bennett;The Classics Deluxe Edition;Vocal Pop Music Vocal;?;This compilation P 2013 Columbia Records a division of Sony Music Entertainment;?;?
?;Ryan Adams;1989;Rock Music;?;?;263.0;21/09/15
YM Salute feat Lil Twist Lil Chuckee Gudda Gudda Jae Millz and Nicki Minaj;Lil Wayne Lil Twist Lil Chuckee Gudda Gudda Jae Millz and Nicki Minaj;I Am Not a Human Being;?;1.29;2010 Cash Money Records Inc;314.0;15/11/10
Twenty Eight;The Weeknd;House of Balloons;?;1.29;2015 The Weeknd XO Inc;?;17/02/15
Beautiful Now Grey Remix feat Jon Bellion;?;Beautiful Now Grey Remix feat Jon Bellion Single;Dance Music;1.29;2015 Interscope Records;190.0;?
