Teardrops On My Guitar Pop Version;Taylor Swift;?;?;?;2008 Big Machine Records LLC All Rights Reserved Under License to UMGD;?;24/10/06
?;?;iTunes Live from SoHo;Country Music Pop Teen Pop Contemporary Country;1.29;?;?;15/01/08
?;?;?;Soundtrack Music Soundtrack;1.29;?;266.0;30/09/14
?;?;Divergent Original Motion Picture Soundtrack Deluxe Version;Soundtrack Music;1.29;2014 Interscope Records;275.0;11/03/14
?;?;All My Friends Celebrating the Songs and Voice of Gregg Allman;Rock Music;1.29;2014 Blackbird Production Partners LLC Under Exclusive License Rounder Records Manufactured and Distributed by Concord Music Group Inc;?;06/05/14
Shell Shocked feat Kill the Noise and Madsonik From Teenage Mutant Ninja Turtles;?;?;HipHop MusicHipHop / Rap Soundtrack;1.29;?;?;?
Life of the Party Acoustic;?;?;Pop Music Rock Vocal Teen Pop Dance;?;2015 Island Records a division of UMG Recordings Inc;193.0;?
Why Me;Jess Glynne;I Cry When I Laugh;Pop Music Dance House Electronic Rock;1.29;?;211.0;?
?;Lady Gaga;Marry the Night The Remixes;Pop Music Electronic Dance RandB / Soul Rock;1.29;?;?;20/12/11
?;Ed Sheeran;You Need Me EP;?;1.29;?;266.0;09/12/11
?;?;?;?;1.99;2012 Atlantic Recording Corporation for the United States and WEA International Inc for the world outside of the United States;320.0;?
?;Shinedown;?;Rock Music Metal Hard Rock Alternative;1.29;?;?;04/10/05
?;?;I ll Stay Me;Country Music Contemporary Country Pop;?;2006 2007 Capitol Records Nashville All rights reserved Unauthorized reproduction is a violation of applicable laws Manufactured by Capitol Records Nashville 3322 West End Avenue 11th Floor Nashville TN 37203;242.0;14/08/07
Bubble Butt Radio Mix feat Bruno Mars 2 Chainz Tyga and Mystic;Major Lazer;Free the Universe Extended Version;?;?;?;207.0;?
Dollar Signs feat Tinashe;?;?;Dance Music RandB / Soul Rock Electronic;1.29;2014 Sony Music Entertainment UK Limited;236.0;?
Angel;The Weeknd;Beauty Behind the Madness;?;1.29;?;?;28/08/15
Beat Down feat Iggy Azalea;Steve Aoki and Angger Dimas;Ultra Summer;Dance Music Electronic;1.29;2012 Ultra Records Inc;?;20/07/12
?;Zedd;Stars Come Out Dillon Francis Remix Single;Dance Music Electronic House;?;2012 Dim Mak Inc;248.0;?
?;?;Honey I m Good Single;Country Music;1.29;2015 SCurve Records;198.0;14/07/15
Speechless;Lady Gaga;The Fame Monster Deluxe Version;Pop Music;1.29;2014 Interscope Records;270.0;05/08/14
?;?;Love Pain and the Whole Crazy Thing;?;?;2006 Capitol Records Nashville All rights reserved Unauthorized reproduction is a violation of applicable laws Manufactured by Capitol Records Nashville 3322 West End Avenue 11th Floor Nashville TN 37203;328.0;10/10/06
?;?;?;RandB / Soul Music;1.29;?;377.0;28/08/15
Goodbye to You feat Dot Rotten;Ed Sheeran;5;?;1.29;2014 Warner Music UK LImited;330.0;?
?;The Weeknd;?;?;?;2015 The Weeknd XO Inc;319.0;17/02/15
?;?;Cheerleader Remixes Single;House Music Dance Reggae Pop;?;?;174.0;?
Act My Age;One Direction;?;Pop Music;?;?;?;17/11/14
I Walk the Line Live;Buddy Miller Don Was Greg Leisz Ian Mclaughlin and Kenny Aronoff;?;Country Music;1.29;?;?;?
?;Holly Williams;?;?;?;2009 Mercury Records a Division of UMG Recordings Inc;?;16/06/09
Rock N Roll Will Take You to the Mountain;Skrillex;More Monsters and Sprites;?;?;2011 Big Beat Records Inc for the United States and WEA International for the world outside the United States;274.0;21/06/11
Caffeine Cold;Fall Out Boy;PAX AM Days;Alternative Music;1.29;?;161.0;15/10/13
?;?;?;?;?;2015 Polydor Ltd UK;290.0;18/09/15
Illusion feat Echosmith;Zedd;?;?;1.29;?;390.0;18/05/15
Thriller Live From Hammersmith Palais;Fall Out Boy;Infinity On High Deluxe Bonus EP;Alternative Music Punk Rock Adult Alternative;0.99;?;?;?
Silver and Gold;?;Pain Killer;Country Music Honky Tonk Contemporary Country;?;?;?;21/10/14
?;Keith Urban;?;Country Music Honky Tonk Contemporary Country;1.29;2013 Hit Red Records under exclusive license to Capitol Records Nashville;232.0;10/09/13
Close Enemies Dyro Remix;?;The Evolution of Man Deluxe Version;DanceMusicElectronicHipHop / Rap Rock;?;2012 Ministry of Sound Recordings Limited;?;?
?;Lady Gaga;The Fame Monster Deluxe Version;?;1.29;2014 Interscope Records;216.0;?
Maps for the Getaway;?;Andrew McMahon In the Wilderness;Alternative Music Rock Pop Pop/Rock Electronic Adult Alternative;?;?;237.0;14/10/14
Jack and Sally Montage;?;?;?;?;2006 Walt Disney Records;317.0;?
?;Jana Kramer;Jana Kramer;Country Music Honky Tonk Contemporary Country;1.29;?;?;01/06/12
?;?;O N I F C;?;1.29;?;?;04/12/12
Take It Out On Me;Florida Georgia Line;?;Country Music Urban Cowboy Honky Tonk Contemporary Country;?;2013 Big Machine Label Group LLC;?;?
My Winding Wheel iTunes Session;Ryan Adams;iTunes Session;?;1.29;2012 PaxAmericana Recording Company Under Exclusive License to Capitol Records All rights reserved Unauthorized reproduction is a violation of applicable laws Manufactured by Capitol Records LLC 1750 North Vine Street Hollywood CA 90028;214.0;?
Stay Wide Awake;Eminem;Relapse Refill;HipHop/Rap Music Rap Hardcore Rap;?;2009 Aftermath Records;319.0;?
The Shipped Gold Standard;?;?;Alternative Music Punk;1.29;2008 The Island Def Jam Music Group;?;?
?;?;?;Country Music;?;2014 Broken Bow Records;?;01/04/14
I m That Remix feat Beenie Man and Azealia Banks;R City;I m That Remix feat Beenie Man and Azealia Banks Single;HipHop/Rap Music;?;2015 Kemosabe Records;210.0;23/03/15
Video Games Omid 16B Instrumental Reprise;?;Blue Jeans Omid 16B Remixes;Dance Music Rock Adult Alternative;?;?;?;21/01/13
?;Rachel Platten;?;Pop Music;1.29;?;218.0;11/09/15
Remember You feat The Weeknd;?;O N I F C Deluxe Version;HipHop/Rap Music East Coast Rap Hardcore Rap Rap;1.99;2012 Atlantic Recording Corporation for the United States and WEA International Inc for the world outside of the United States;320.0;?
?;Ed Sheeran;Loose Change;Singer/Songwriter Music Contemporary Singer/Songwriter Rock Adult Alternative;?;2010 All tracks p 2010 Paw Print Records under exclusive license to Warner Music UK Limited except for track 1 p 2011Paw Print Records under exclusive license to Warner Music UK Limited;?;09/12/11
?;?;#SELFIE The Remixes Single;?;1.29;2014 Dim Mak Inc under exclusive license to Republic Records a Division of UMG Recordings Inc and Universal Island Records a Division of Universal Music Operations Ltd;?;17/06/14
I ve Got All This Ringing In My Ears and None On My Fingers;Fall Out Boy;Infinity On High;Alternative Music Rock Adult Alternative Punk;0.99;?;246.0;06/02/07
Crack In the Pearl Pt II feat Stevie Wonder and Jeff Bhasker;Mark Ronson;Uptown Special;?;?;Tracks 3 4 and 6 P 2014 all other tracks P 2015 Mark Ronson under exclusive licence to Sony Music Entertainment UK Limited;136.0;12/01/15
?;Justin Bieber;Under the Mistletoe;Holiday Music Christmas Pop Teen Pop Rock;?;?;192.0;01/11/11
?;?;No Shadow Single;?;?;2014 PaxAmericana Recording Company;78.0;13/01/15
Kickstart My Heart;Rascal Flatts;Nashville Outlaws A Tribute to M  tley Cre;Country Music;?;2014 Big Machine Records LLC;233.0;19/08/14
?;Howard Shore;?;?;1.29;?;316.0;?
W A M S;?;?;Alternative Music Punk;0.99;?;278.0;16/12/08
?;Saint Lucia;?;?;0.99;2012 Kitsun ;143.0;?
?;Ellie Goulding;Halcyon Days Deluxe Edition;Pop Music Dance Rock;?;?;283.0;27/08/13
Underage;?;The First Time;?;1.29;2015 Black River Entertainment;190.0;18/05/15
?;?;Ultraviolence Deluxe;?;1.29;2014 Lana Del Rey under exclusive licence to Polydor Ltd UK Under exclusive licence to Interscope Records in the USA;?;16/06/14
Crack a Bottle feat Dr Dre and 50 Cent;Eminem Dr Dre and 50 Cent;?;HipHop/Rap Music Rap Hardcore Rap;?;?;297.0;21/12/09
Swan Song;?;Honeymoon;Alternative Music Rock Adult Alternative;?;2015 Polydor Ltd UK;323.0;?
?;Calvin Harris;?;?;0.99;2007 SONY BMG MUSIC ENTERTAINMENT UK Limited;298.0;11/06/07
Is It Love;?;?;Pop Music Dance RandB / Soul Pop/Rock Teen Pop Contemporary RandB;0.99;?;218.0;?
?;?;iTunes Session;Rock Music;?;?;?;24/04/12
?;Ryan Adams;Gold;Rock Music;1.29;2014 UMG Recordings Inc;204.0;30/09/14
Brave Honest Beautiful feat Meghan Trainor;?;Reflection Deluxe;Pop Music RandB / Soul Dance Teen Pop Rock;1.29;2014 2015 Simco Ltd under exclusive license to Epic Records a division of Sony Music Entertainment;?;30/01/15
?;The Weeknd;?;RandB / Soul Music Rock Contemporary RandB;?;?;?;10/09/13
Goner;twenty one pilots;Blurryface;?;1.29;?;?;?
?;?;Kill the Lights;Country Music Rock Contemporary Country;1.29;?;218.0;07/08/15
?;Flo Rida;Jump Remixes feat Nelly Furtado;?;1.29;2009 Atlantic Recording Corporation for the United States and WEA International Inc for the world outside of the United States;274.0;01/09/09
Four Pink Walls;?;Four Pink Walls EP;Pop Music Rock RandB / Soul Contemporary RandB;?;2015 Def Jam Recordings a division of UMG Recordings Inc;?;26/08/15
Creepin Live;?;Caught In the Act Live;Country Music Contemporary Country Urban Cowboy;?;?;287.0;05/04/13
What s Wrong With Them feat Nicki Minaj;?;I Am Not a Human Being;HipHop/Rap Music Rap Hardcore Rap Dirty South;?;?;?;15/11/10
?;Macklemore and Ryan Lewis;?;HipHop/Rap Music Rap West Coast Rap Alternative Rap Rock;1.29;?;?;?
The Heavy and the Slow Live;?;Live from L A;Pop Music Rock;?;2012 SCurve Records;?;?
?;?;?;?;1.29;2015 Bottleneck Music Limited under exclusive license to Concord Music Group Inc;212.0;21/08/15
Hotel Chelsea Nights;Ryan Adams;Love Is Hell;?;1.29;2014 UMG Recordings Inc;311.0;04/05/04
?;Macklemore and Ryan Lewis;Irish Celebration Single;HipHop MusicHipHop / Rap Rap;1.29;?;?;20/03/14
The Patron Saint of Liars and Fakes Album Version;?;Take This to Your Grave;?;?;?;?;?
?;?;?;?;?;2013 Cash Money Records Inc;?;24/09/13
Nights and Weekends;Cold War Kids;Hold My Home Deluxe Edition;Alternative Music Indie Rock Rock;?;2014 Downtown Records;174.0;11/09/15
?;Brothers Osborne;Let s Go There Single;Country Music;1.29;?;175.0;10/09/13
Jump Up Thom Yorke Remix;Major Lazer;Lazers Never Die EP;?;?;?;?;20/07/10
?;Macklemore and Ryan Lewis;?;?;?;?;?;01/08/12
Anything Could Happen Guy Scheiman TLV Club Remix;?;Anything Could Happen Remixed;Pop Music Rock;1.29;2013 Polydor Ltd UK;465.0;?
Gal a Bubble;Konshens;Strictly the Best Vol 51;Reggae Music;1.29;?;211.0;?
I m Not Alone deadmau5 Mix Bonus Track;Calvin Harris;?;?;0.99;2009 Sony Music Entertainment Limited under exclusive license to Ultra Records Inc;495.0;?
Do What U Want feat Christina Aguilera Red Ant and Amp Lexvas Deep House Remix;?;?;?;?;2014 Interscope Records;?;?
Till Dawn Here Comes the Sun;?;Echoes of Silence;RandB / Soul Music Contemporary RandB Rock;?;2015 The Weeknd XO Inc;?;?
?;Ryan Adams;Ashes and Fire;?;1.29;?;?;30/09/14
Ride Lyla s Surprise James Lavelle Remix;Lana Del Rey;?;?;?;?;493.0;19/11/12
?;The Weeknd;Echoes of Silence;?;?;2015 The Weeknd XO Inc;?;?
Red Instrumental With Background Vocals;Taylor Swift;Taylor Swift Karaoke Red;Country Music Honky Tonk Pop Teen Pop Contemporary Country Rock;1.29;2013 Big Machine Records LLC;223.0;?
?;Lady Gaga;?;Jazz Music Pop Crossover Jazz Vocal Jazz;?;2014 Columbia Records a division of Sony Music Entertainment / Interscope Records a division of UMG Recordings Inc;223.0;?
Shut Up Train;Little Big Town;The Reason Why;Country Music Rock Singer/Songwriter Contemporary Singer/Songwriter Southern Rock Contemporary Country Urban Cowboy;1.29;?;?;?
?;Drake;Take Care Deluxe Version;?;1.29;?;219.0;15/11/11
Black Jesus + Amen Fashion;Lady Gaga;?;?;?;2014 Interscope Records;?;?
Tessellate Bonus Track;Ellie Goulding;Halcyon Days Deluxe Edition;?;1.29;?;?;?
Original Don feat The Partysquad The Partysquad and Punish Smash Em Remix;Major Lazer;?;Electronic Music Dance;?;2011 Downtown Records Unders exclusive license to Interscope Records in the U S A;218.0;01/11/11
You re My Better Half;?;?;Country Music Honky Tonk Contemporary Country;1.29;?;?;08/01/08
Breaks;Wiz Khalifa and John Cena;?;?;1.29;2014 Atlantic Recording Corporation for the United States and WEA International for the world outside the United States A Warner Music Group Company;244.0;21/10/14
Marry the Night Danny Verde Remix;Lady Gaga;?;Pop Music Electronic Dance RandB / Soul Rock;1.29;2011 Interscope Records;?;20/12/11
Some Day;Shinedown;Us and Them;Rock Music Metal Alternative Hard Rock;?;?;194.0;04/10/05
Bang Bang My Baby Shot Me Down Live from Jazz At Lincoln Center Bonus Track;?;?;Jazz Music Pop Crossover Jazz Vocal Jazz;1.29;2014 Columbia Records a division of Sony Music Entertainment / Interscope Records a division of UMG Recordings Inc;?;?
?;PNK;?;?;1.29;2009 RCA/JIVE Label Group a unit of Sony Music Entertainment;242.0;?
?;PNK;Funhouse Tour Live In Australia;Pop Music Dance RandB / Soul Pop/Rock;0.99;2009 RCA/JIVE Label Group a unit of Sony Music Entertainment;204.0;?
Closer feat Mike Posner;?;Nick Jonas Deluxe;Pop Music Rock Pop/Rock;1.29;2014 Island Records a division of UMG Recordings Inc / Safehouse Records LLC;?;?
?;?;?;?;?;2013 Polydor Ltd UK;223.0;?
Hotline Bling;Drake;?;?;1.29;2015 Cash Money Records Inc;?;?
?;WALK THE MOON;TALKING IS HARD;?;1.29;?;?;?
It s All Your Fault;PNK;Funhouse Deluxe Version;?;1.29;?;232.0;28/10/08
I Have Seen the Rain feat James T Moore;PNK;?;Pop Music Electronic RandB / Soul Dance Pop/Rock;0.99;2006 LaFace Records LLC;210.0;03/04/06
?;Benny Benassi;Ultra / Wynn Presents Encore Beach Club Las Vegas Sessions Vol 1 Mixed By Sidney Samson;?;1.29;2012 Ultra Records Inc;307.0;28/08/12
Eyes Open;?;?;Soundtrack Music;1.29;2012 Universal Republic Records a division of UMG Recordings Inc;244.0;?
White Christmas;Taylor Swift;The Taylor Swift Holiday Collection EP;Holiday Music Country Honky Tonk Christmas;?;2008 Big Machine Records LLC;?;14/10/07
Summer Love;One Direction;?;?;1.29;?;?;?
?;Shinedown;?;Rock Music Hard Rock Alternative;1.29;2009 Atlantic Recording Corporation for the United States and WEA International for the world outside of the United States;239.0;?
Jack Daniels and Jesus;Chase Rice;Ignite the Night;?;1.29;?;?;19/08/14
Blue Jeans Penguin Prison Remix;Lana Del Rey;?;?;1.29;2012 Lana Del Rey under exclusive licence to Polydor Ltd UK Under exclusive licence to Interscope Records in the USA;?;01/05/12
Sunburn;Ed Sheeran;?;?;?;?;?;09/12/11
Want to Want Me;?;?;?;1.29;2015 BY Music;207.0;?
?;Carrie Underwood;Carnival Ride;Country Music Rock Pop Contemporary Country;0.99;2007 19 Recordings Limited;?;22/10/07
?;Luke Bryan;Doin My Thing;Country Music Contemporary Country;1.29;2009 Capitol Records Nashville All rights reserved Unauthorized reproduction is a violation of applicable laws Manufactured by Capitol Records Nashville 3322 West End Avenue 11th Floor Nashville TN 37203;179.0;02/10/09
Be the One;NeYo;?;?;1.29;2012 Motown Records a Division of UMG Recordings Inc;227.0;06/11/12
?;Lana Del Rey;Born To Die The Paradise Edition;Alternative Music Rock Adult Alternative;1.29;?;229.0;13/11/12
ID Ultra Music Festival Anthem;Kygo;ID Ultra Music Festival Anthem Single;Dance Music Electronic;?;2015 Kygo under exclusive license to Sony Music Enterntainment Ltd / Ultra Records LLC;289.0;?
?;Shadow Child;?;Fitness and Workout Music;1.29;?;?;05/01/15
Thinking About You feat Ayah Marar;?;?;Dance Music House Rock Electronic;?;2012 Sony Music Entertainment UK under exclusive license to Ultra Music / Roc Nation / Columbia Records;247.0;?
?;Justin Bieber;Believe Acoustic;?;?;2013 The Island Def Jam Music Group;?;?
Workin Man Blues;Parmalee;Working Man s Poet A Tribute To Merle Haggard;?;1.29;2014 Broken Bow Records;162.0;?
Anything Could Happen Guy Scheiman TLV Club Remix;Ellie Goulding;?;Pop Music Rock;?;?;465.0;15/01/13
?;?;Fuse Deluxe Version;?;1.29;2013 Hit Red Records under exclusive license to Capitol Records Nashville;186.0;10/09/13
Upside Down;Tori Kelly;?;Pop Music Rock;?;2012 Toraay Records;199.0;01/05/12
Nothing Like Us Bonus Track;Justin Bieber;?;Pop Music Rock Vocal Teen Pop;?;?;199.0;29/01/13
?;?;?;Dance Music Electronic;1.29;2010 Big Beat Records Inc A Warner Music Group Company;?;25/10/10
White Christmas;?;The Taylor Swift Holiday Collection EP;Holiday Music Country Honky Tonk Christmas;?;2008 Big Machine Records LLC;154.0;14/10/07
Rainy Night In Georgia;Chris Young;?;Country Music Contemporary Country;0.99;?;?;27/08/09
Right Above It feat Drake;?;?;?;1.29;?;?;15/11/10
Hey Mama feat Nicki Minaj Bebe Rexha and Afrojack Extended;?;Hey Mama feat Nicki Minaj Bebe Rexha and Afrojack Remixes EP;Dance Music;1.29;2015 What A Music Ltd under exclusive license to Parlophone/Warner Music France under exclusive license to Atlantic Recording Corporation for the United States;?;12/05/15
A Rose and a Kiss;Aaron Zigman;The Best of Me Original Motion Picture Soundtrack;?;1.29;?;288.0;?
Tell Me When You Ready feat Future;Flo Rida;Tell Me When You Ready feat Future Single;?;1.29;2013 Atlantic Recording Corporation for the United States and WEA International Inc for the world outside of the United States;166.0;?
Pretty When You Cry;Lana Del Rey;?;Alternative Music Rock Adult Alternative;1.29;2014 Lana Del Rey under exclusive licence to Polydor Ltd UK Under exclusive licence to Interscope Records in the USA;?;16/06/14
The Only Reason;?;?;Pop Music Teen Pop Rock;1.29;?;?;?
?;?;Wildflower;?;1.29;2011 19 Recordings Inc;?;11/10/11
Na Na Na Live;One Direction;iTunes Festival London 2012 EP;Pop Music;1.29;?;?;?
Love Is the Drug;?;?;Soundtrack Music Classical Soundtrack;1.29;2013 Interscope Records;161.0;07/05/13
My Neck My Back Live;?;The Elle King EP;?;?;2012 RCA Records a division of Sony Music Entertainment;160.0;?
?;5 Seconds of Summer;5 Seconds of Summer Bonus Track Version;Pop Music Teen Pop Alternative Punk Rock;1.29;2014 Capitol Records Ltd;?;22/07/14
?;?;Halcyon Days Deluxe Edition;?;1.29;?;?;27/08/13
Livin Part of Life;Eric Church;Chief / Caught In the Act / Carolina / Sinners Like Me;?;1.29;2013 Capitol Nashville;?;?
?;?;Try This;Pop Music Dance RandB / Soul Pop/Rock Teen Pop Electronic;1.29;2003 Arista Records Inc;?;11/11/03
?;Taylor Swift;1989;Pop Music Rock;1.29;?;212.0;27/10/14
Back to Me;Daya;Daya EP;?;1.29;2015 ARTBEATZ;240.0;?
?;Little Big Town;A Place to Land;Contemporary Singer/Songwriter Music Singer/Songwriter Country Rock Southern Rock Urban Cowboy Contemporary CountryFolkRock;1.29;?;202.0;?
Fly;Maddie and Tae;?;Country Music Rock Contemporary Country Pop Pop/Rock Honky Tonk;?;2015 Republic Records a Division of UMG Recordings Inc Dot Records;?;?
Little Me Unplugged;Little Mix;Salute Deluxe Edition;Pop Music;1.29;2013 Simco Limited under exclusive licence to Sony Music Entertainment UK Limited;?;04/02/14
?;Wiz Khalifa;O N I F C Deluxe Version;HipHop/Rap Music East Coast Rap Hardcore Rap Rap;1.99;2012 Atlantic Recording Corporation for the United States and WEA International Inc for the world outside of the United States;?;04/12/12
Beyond the Forest;Howard Shore;?;?;?;2013 WaterTower Music;?;10/12/13
?;?;Starry Eyed Remixes EP;Dance Music Pop Rock;1.29;?;?;15/02/11
Broken Strings feat James Morrison;?;?;Pop Music Rock Vocal Adult Alternative Singer/Songwriter Contemporary Singer/Songwriter;0.99;?;250.0;16/11/10
Born This Way;Lady Gaga;?;Pop Music Rock Dance;1.29;2014 Interscope Records;260.0;?
Sweet Spot 2 0 feat Jennifer Lopez;Flo Rida;Wild Ones;HipHop/Rap Music Rap Electronic World Dance;1.29;?;?;22/06/12
Bluegrass Saturday Night;Rhonda Vincent;Good Thing Going;?;?;?;?;21/07/08
?;Kenny Chesney;?;Country Music Honky Tonk Contemporary Country;?;2010 Sony Music Entertainment;242.0;?
The Alphabeat;David Guetta;?;Dance Music Electronic Rock House;?;?;269.0;26/08/11
Unapologize;Carrie Underwood;?;Country Music Pop Adult Contemporary Contemporary Country Rock;?;2009 19 Recordings Limited under exclusive license to Arista Nashville;278.0;03/11/09
Raise Your Weapon;?;?;Dance Music Electronic;0.99;?;472.0;07/02/12
Better Than Words;One Direction;Midnight Memories;?;1.29;2013 Simco Limited under exclusive license to Sony Music Entertainment UK Limited;207.0;25/11/13
This Song Has No Title Live At Hammersmith Odeon London 1973;Elton John;?;?;1.29;?;177.0;24/03/14
?;?;The Jersey Shore 3;?;0.99;?;?;?
?;Shinedown;?;Rock Music Metal Alternative Hard Rock;?;2005 Atlantic Recording Corp For the United States and WEA International Inc for the world outside of the United States;?;04/10/05
?;?;?;?;?;?;258.0;?
?;Clarian and Guy Gerber;?;?;1.29;2013 Ministry of Sound Recordings Limited;?;21/07/13
Lifted feat Emeli Sand  and Professor Green;Naughty Boy;Hotel Cabana Deluxe Version;?;1.29;2013 Naughty Boy Recordings Ltd under exclusive licence to Virgin Records Ltd;?;06/05/14
?;Tori Kelly;?;?;1.29;2015 Capitol Records and Schoolboy Records;188.0;23/06/15
In the Dark;Ryan Adams;I Do Not Feel Like Being Good Single;Rock Music;1.29;2015 PaxAmericana Recording Company;?;28/04/15
So Happy I Could Die;Lady Gaga;The Fame Monster Deluxe Version;Pop Music;1.29;2014 Interscope Records;234.0;?
Dollar Signs feat Tinashe;Calvin Harris;?;?;1.29;2014 Sony Music Entertainment UK Limited;236.0;04/11/14
?;Florida Georgia Line;Anything Goes;?;1.29;?;?;?
?;deadmau5;Ultra Dubstep;?;1.29;2012 Ultra Records Inc;?;09/10/12
Sunburn Bonus Track;?;#NAME;Singer/Songwriter Music;1.29;2011 Warner Music UK Limited;275.0;09/09/11
?;Nick Jonas and The Administration;?;?;0.99;2010 Jonas Enterprises;294.0;02/02/10
Take My Drunk Ass Home Demo;?;Spring Break Here to Party;Country Music Contemporary Country;?;2013 Capitol Records Nashville All rights reserved Unauthorized reproduction is a violation of applicable laws Manufactured by Capitol Records Nashville 401 Commerce Street Suite 1100 Nashville TN 37219;202.0;01/03/13
Till I Found You Bonus Track;?;?;?;1.29;2014 PaxAmericana Recording Company;259.0;?
?;Zedd;?;?;0.99;?;299.0;?
The Patron Saint of Liars and Fakes Album Version;Fall Out Boy;?;Alternative Music Punk Rock;?;?;?;06/05/03
Like Me;?;The Road and the Radio;Country Music Honky Tonk Urban Cowboy Contemporary Country;0.99;2005 BMG Music;311.0;06/11/05
?;?;5 Seconds of Summer Bonus Track Version;Pop Music Teen Pop Alternative Punk Rock;1.29;2014 Capitol Records Ltd;165.0;22/07/14
Crack In the Pearl Pt II feat Stevie Wonder and Jeff Bhasker;?;Uptown Special;Pop Music RandB / Soul Soul Funk Electronic;1.29;?;?;?
?;?;?;Pop Music Electronic Dance RandB / Soul Rock;?;?;465.0;?
?;Little Big Town;?;Contemporary Singer/Songwriter Music Singer/Songwriter Country Rock Southern Rock Urban Cowboy Contemporary CountryFolkRock;?;2007 2008 Little Big Town LLC under exclusive license to Capitol Records Nashville;?;?
VHS Outro Interlude;X Ambassadors;VHS;Alternative Music Rock Adult Alternative;?;?;?;?
Human;?;?;Dance Music Electronic House;?;?;?;31/07/12
?;Wiz Khalifa;?;?;?;?;203.0;24/11/09
Crack In the Pearl Pt II feat Stevie Wonder and Jeff Bhasker;Mark Ronson;?;?;1.29;?;136.0;?
Growing Her Wings;Lauren Alaina;Wildflower;?;1.29;2011 19 Recordings Inc;181.0;?
Epilogue feat George the Poet;?;Hotel Cabana;?;1.29;?;88.0;06/05/14
If This Was a Movie;Taylor Swift;If This Was a Movie Single;?;?;?;234.0;08/11/11
?;?;I Created Disco;Electronic Music Pop Dance Rock;?;2007 SONY BMG MUSIC ENTERTAINMENT UK Limited;298.0;?
?;?;Peace Is the Mission;?;1.29;2015 Mad Decent;?;01/06/15
?;Eric Church;Chief / Caught In the Act / Carolina / Sinners Like Me;?;?;?;269.0;?
VHS Outro Interlude;X Ambassadors;VHS;Alternative Music Rock Adult Alternative;1.29;2015 KIDinaKORNER/Interscope Records;?;30/06/15
My Favorite Memory;Joe Nichols;?;Country Music;?;2014 Broken Bow Records;?;?
Dream;Miley Cyrus;Hannah Montana The Movie Original Motion Picture Soundtrack;Soundtrack Music Country Contemporary Country Pop Teen Pop Honky Tonk Rock;1.29;?;?;?
Who s That Chick feat Rihanna Single Version;?;Who s That Chick feat Rihanna EP;?;?;?;165.0;?
There s a Guy Works Down the Chip Shop Swears He s Elvis Live;Phil Jupitus Boz Boorer and Phil Rambow;?;?;?;2013 Union Square Music Ltd;236.0;?
?;Fall Out Boy;American Beauty / American Psycho;?;1.29;?;220.0;20/01/15
?;?;Everything Is 4;?;?;2015 Warner Bros Records Inc;?;?
?;David Guetta;Titanium Spanish Version Single;?;1.29;2012 What A Music Ltd Licence exclusive Parlophone Music France;238.0;20/08/12
The Climb;?;Hannah Montana The Movie Original Motion Picture Soundtrack;?;1.29;2009 Walt Disney Records;?;24/03/09
?;Shinedown;?;Rock Music Metal Alternative Hard Rock;?;?;306.0;18/04/11
I Thought You Knew;Keith Urban;Keith Urban;Country Music Honky Tonk Contemporary Country;?;1999 Capitol Records Nashville;231.0;?
We Know;?;?;?;1.29;?;177.0;30/01/15
Boyfriend Joe Gauthreaux Dark Dub;Justin Bieber;?;?;1.29;2012 The Island Def Jam Music Group;466.0;12/06/12
Remember You feat The Weeknd;?;O N I F C Deluxe Version;HipHop/Rap Music East Coast Rap Hardcore Rap Rap;1.99;2012 Atlantic Recording Corporation for the United States and WEA International Inc for the world outside of the United States;320.0;04/12/12
Marry Me;?;?;?;?;2013 2014 Warner Bros Records Inc;?;?
The Way I Loved You;Taylor Swift;?;Country Music Rock Honky Tonk Pop Adult Contemporary Contemporary Country;?;?;244.0;11/11/08
Second Chance Live Acoustic from Kansas City;?;Somewhere In the Stratosphere Live;Rock Music Metal Alternative Hard Rock;1.29;2011 Atlantic Recording Corporation for the United States and WEA International Inc for the world outside of the United States;306.0;18/04/11
?;Eric Church;?;?;1.29;?;?;11/02/14
?;Shinedown;Somewhere In the Stratosphere Live;?;?;2011 Atlantic Recording Corporation for the United States and WEA International Inc for the world outside of the United States;306.0;?
Philadelphia Freedom;Elton John;Goodbye Yellow Brick Road 40th Anniversary Celebration Super Deluxe Edition;?;?;2014 Mercury Records Limited;?;?
Love Song;PNK;?;Pop Music Teen Pop Electronic Pop/Rock RandB / Soul Dance;0.99;2003 Arista Records Inc;148.0;?
Maneater;?;The Best of Nelly Furtado Deluxe Version;?;1.29;?;258.0;?
Tackle Box;Luke Bryan;?;?;1.29;2006 2007 Capitol Records Nashville All rights reserved Unauthorized reproduction is a violation of applicable laws Manufactured by Capitol Records Nashville 3322 West End Avenue 11th Floor Nashville TN 37203;242.0;14/08/07
